drop table if exists t, s;
create table t (id int, name varchar(10));
create table s (id int, name varchar(10));
explain format='plan_tree' select * from t, (select * from s where s.id>1) tmp where t.id=tmp.id; -- inner join;
id	task	access object	operator info
HashJoin	root		inner join, equal:[eq(planner__core__rule_constant_propagation.t.id, planner__core__rule_constant_propagation.s.id)]
├─TableReader(Build)	root		data:Selection
│ └─Selection	cop[tikv]		gt(planner__core__rule_constant_propagation.s.id, 1), not(isnull(planner__core__rule_constant_propagation.s.id))
│   └─TableFullScan	cop[tikv]	table:s	keep order:false, stats:pseudo
└─TableReader(Probe)	root		data:Selection
  └─Selection	cop[tikv]		gt(planner__core__rule_constant_propagation.t.id, 1), not(isnull(planner__core__rule_constant_propagation.t.id))
    └─TableFullScan	cop[tikv]	table:t	keep order:false, stats:pseudo
explain format='plan_tree' select * from t, (select * from s where s.id>1) tmp where t.name=tmp.name; -- can't, without id equal predicate;
id	task	access object	operator info
Projection	root		planner__core__rule_constant_propagation.t.id, planner__core__rule_constant_propagation.t.name, planner__core__rule_constant_propagation.s.id, planner__core__rule_constant_propagation.s.name
└─HashJoin	root		inner join, equal:[eq(planner__core__rule_constant_propagation.s.name, planner__core__rule_constant_propagation.t.name)]
  ├─TableReader(Build)	root		data:Selection
  │ └─Selection	cop[tikv]		gt(planner__core__rule_constant_propagation.s.id, 1), not(isnull(planner__core__rule_constant_propagation.s.name))
  │   └─TableFullScan	cop[tikv]	table:s	keep order:false, stats:pseudo
  └─TableReader(Probe)	root		data:Selection
    └─Selection	cop[tikv]		not(isnull(planner__core__rule_constant_propagation.t.name))
      └─TableFullScan	cop[tikv]	table:t	keep order:false, stats:pseudo
explain format='plan_tree' select * from t, (select name from s where s.id>1) tmp where t.name=tmp.name; -- can't, projection without id column;
id	task	access object	operator info
Projection	root		planner__core__rule_constant_propagation.t.id, planner__core__rule_constant_propagation.t.name, planner__core__rule_constant_propagation.s.name
└─HashJoin	root		inner join, equal:[eq(planner__core__rule_constant_propagation.s.name, planner__core__rule_constant_propagation.t.name)]
  ├─TableReader(Build)	root		data:Selection
  │ └─Selection	cop[tikv]		gt(planner__core__rule_constant_propagation.s.id, 1), not(isnull(planner__core__rule_constant_propagation.s.name))
  │   └─TableFullScan	cop[tikv]	table:s	keep order:false, stats:pseudo
  └─TableReader(Probe)	root		data:Selection
    └─Selection	cop[tikv]		not(isnull(planner__core__rule_constant_propagation.t.name))
      └─TableFullScan	cop[tikv]	table:t	keep order:false, stats:pseudo
explain format='plan_tree' select * from t, (select id as id1, name as name1 from s where s.id>1) tmp where t.id=tmp.id1; -- projection above of s.id>1;
id	task	access object	operator info
HashJoin	root		inner join, equal:[eq(planner__core__rule_constant_propagation.t.id, planner__core__rule_constant_propagation.s.id)]
├─TableReader(Build)	root		data:Selection
│ └─Selection	cop[tikv]		gt(planner__core__rule_constant_propagation.s.id, 1), not(isnull(planner__core__rule_constant_propagation.s.id))
│   └─TableFullScan	cop[tikv]	table:s	keep order:false, stats:pseudo
└─TableReader(Probe)	root		data:Selection
  └─Selection	cop[tikv]		gt(planner__core__rule_constant_propagation.t.id, 1), not(isnull(planner__core__rule_constant_propagation.t.id))
    └─TableFullScan	cop[tikv]	table:t	keep order:false, stats:pseudo
explain format='plan_tree' select * from t, (select id +1 as id1 from s where s.id>1) tmp where t.id=tmp.id1; -- can't optimize, projection has column function;
id	task	access object	operator info
Projection	root		planner__core__rule_constant_propagation.t.id, planner__core__rule_constant_propagation.t.name, Column#9
└─HashJoin	root		inner join, equal:[eq(Column#9, planner__core__rule_constant_propagation.t.id)]
  ├─Projection(Build)	root		plus(planner__core__rule_constant_propagation.s.id, 1)->Column#9
  │ └─TableReader	root		data:Selection
  │   └─Selection	cop[tikv]		gt(planner__core__rule_constant_propagation.s.id, 1), not(isnull(plus(planner__core__rule_constant_propagation.s.id, 1)))
  │     └─TableFullScan	cop[tikv]	table:s	keep order:false, stats:pseudo
  └─TableReader(Probe)	root		data:Selection
    └─Selection	cop[tikv]		not(isnull(planner__core__rule_constant_propagation.t.id))
      └─TableFullScan	cop[tikv]	table:t	keep order:false, stats:pseudo
drop table if exists t, s;
create table t (id int, name varchar(10));
create table s (id int, name varchar(10));
explain format='plan_tree' select * from (select * from t where t.id >1) tmp1, (select * from s where s.id <4) tmp2 where tmp1.id=tmp2.id; -- inner join, both children can be optimized;
id	task	access object	operator info
HashJoin	root		inner join, equal:[eq(planner__core__rule_constant_propagation.t.id, planner__core__rule_constant_propagation.s.id)]
├─TableReader(Build)	root		data:Selection
│ └─Selection	cop[tikv]		gt(planner__core__rule_constant_propagation.s.id, 1), lt(planner__core__rule_constant_propagation.s.id, 4), not(isnull(planner__core__rule_constant_propagation.s.id))
│   └─TableFullScan	cop[tikv]	table:s	keep order:false, stats:pseudo
└─TableReader(Probe)	root		data:Selection
  └─Selection	cop[tikv]		gt(planner__core__rule_constant_propagation.t.id, 1), lt(planner__core__rule_constant_propagation.t.id, 4), not(isnull(planner__core__rule_constant_propagation.t.id))
    └─TableFullScan	cop[tikv]	table:t	keep order:false, stats:pseudo
explain format='plan_tree' select * from (select * from t where t.id>1) tmp, s where tmp.id=s.id; -- inner join, child 0;
id	task	access object	operator info
HashJoin	root		inner join, equal:[eq(planner__core__rule_constant_propagation.t.id, planner__core__rule_constant_propagation.s.id)]
├─TableReader(Build)	root		data:Selection
│ └─Selection	cop[tikv]		gt(planner__core__rule_constant_propagation.s.id, 1), not(isnull(planner__core__rule_constant_propagation.s.id))
│   └─TableFullScan	cop[tikv]	table:s	keep order:false, stats:pseudo
└─TableReader(Probe)	root		data:Selection
  └─Selection	cop[tikv]		gt(planner__core__rule_constant_propagation.t.id, 1), not(isnull(planner__core__rule_constant_propagation.t.id))
    └─TableFullScan	cop[tikv]	table:t	keep order:false, stats:pseudo
explain format='plan_tree' select * from (select * from t where t.id>1) tmp left join s on tmp.id=s.id; -- left join, only left child can be optimized;
id	task	access object	operator info
HashJoin	root		left outer join, left side:TableReader, equal:[eq(planner__core__rule_constant_propagation.t.id, planner__core__rule_constant_propagation.s.id)]
├─TableReader(Build)	root		data:Selection
│ └─Selection	cop[tikv]		gt(planner__core__rule_constant_propagation.s.id, 1), not(isnull(planner__core__rule_constant_propagation.s.id))
│   └─TableFullScan	cop[tikv]	table:s	keep order:false, stats:pseudo
└─TableReader(Probe)	root		data:Selection
  └─Selection	cop[tikv]		gt(planner__core__rule_constant_propagation.t.id, 1)
    └─TableFullScan	cop[tikv]	table:t	keep order:false, stats:pseudo
explain format='plan_tree' select * from t left join (select * from s where s.id>1) tmp on t.id=tmp.id; -- can't, left join;
id	task	access object	operator info
HashJoin	root		left outer join, left side:TableReader, equal:[eq(planner__core__rule_constant_propagation.t.id, planner__core__rule_constant_propagation.s.id)]
├─TableReader(Build)	root		data:Selection
│ └─Selection	cop[tikv]		gt(planner__core__rule_constant_propagation.s.id, 1), not(isnull(planner__core__rule_constant_propagation.s.id))
│   └─TableFullScan	cop[tikv]	table:s	keep order:false, stats:pseudo
└─TableReader(Probe)	root		data:TableFullScan
  └─TableFullScan	cop[tikv]	table:t	keep order:false, stats:pseudo
explain format='plan_tree' select * from t right join (select * from s where s.id>1) tmp on t.id=tmp.id; -- right join, only right child can be optimized;
id	task	access object	operator info
HashJoin	root		right outer join, left side:TableReader, equal:[eq(planner__core__rule_constant_propagation.t.id, planner__core__rule_constant_propagation.s.id)]
├─TableReader(Build)	root		data:Selection
│ └─Selection	cop[tikv]		gt(planner__core__rule_constant_propagation.s.id, 1)
│   └─TableFullScan	cop[tikv]	table:s	keep order:false, stats:pseudo
└─TableReader(Probe)	root		data:Selection
  └─Selection	cop[tikv]		gt(planner__core__rule_constant_propagation.t.id, 1), not(isnull(planner__core__rule_constant_propagation.t.id))
    └─TableFullScan	cop[tikv]	table:t	keep order:false, stats:pseudo
explain format='plan_tree' select * from (select * from t where t.id>1) tmp  right join s on tmp.id=s.id; -- can't, right join;
id	task	access object	operator info
HashJoin	root		right outer join, left side:TableReader, equal:[eq(planner__core__rule_constant_propagation.t.id, planner__core__rule_constant_propagation.s.id)]
├─TableReader(Build)	root		data:Selection
│ └─Selection	cop[tikv]		gt(planner__core__rule_constant_propagation.t.id, 1), not(isnull(planner__core__rule_constant_propagation.t.id))
│   └─TableFullScan	cop[tikv]	table:t	keep order:false, stats:pseudo
└─TableReader(Probe)	root		data:TableFullScan
  └─TableFullScan	cop[tikv]	table:s	keep order:false, stats:pseudo
drop table if exists t, s;
create table t (id int, name varchar(10));
create table s (id int, name varchar(10));
explain format='plan_tree' select * from t, (select id as id1 from s where s.id>1) tmp where t.id=tmp.id1; -- constant propagation can through the projection node;
id	task	access object	operator info
HashJoin	root		inner join, equal:[eq(planner__core__rule_constant_propagation.t.id, planner__core__rule_constant_propagation.s.id)]
├─TableReader(Build)	root		data:Selection
│ └─Selection	cop[tikv]		gt(planner__core__rule_constant_propagation.s.id, 1), not(isnull(planner__core__rule_constant_propagation.s.id))
│   └─TableFullScan	cop[tikv]	table:s	keep order:false, stats:pseudo
└─TableReader(Probe)	root		data:Selection
  └─Selection	cop[tikv]		gt(planner__core__rule_constant_propagation.t.id, 1), not(isnull(planner__core__rule_constant_propagation.t.id))
    └─TableFullScan	cop[tikv]	table:t	keep order:false, stats:pseudo
explain format='plan_tree' select * from t, (select id, count(name) from s where s.id>1 group by id) tmp where t.id=tmp.id; -- can't, constant propagation can't through the aggregation node;
id	task	access object	operator info
Projection	root		planner__core__rule_constant_propagation.t.id, planner__core__rule_constant_propagation.t.name, planner__core__rule_constant_propagation.s.id, Column#9
└─Projection	root		planner__core__rule_constant_propagation.t.id, planner__core__rule_constant_propagation.t.name, Column#9, planner__core__rule_constant_propagation.s.id
  └─HashJoin	root		inner join, equal:[eq(planner__core__rule_constant_propagation.s.id, planner__core__rule_constant_propagation.t.id)]
    ├─HashAgg(Build)	root		group by:planner__core__rule_constant_propagation.s.id, funcs:count(Column#10)->Column#9, funcs:firstrow(planner__core__rule_constant_propagation.s.id)->planner__core__rule_constant_propagation.s.id
    │ └─TableReader	root		data:HashAgg
    │   └─HashAgg	cop[tikv]		group by:planner__core__rule_constant_propagation.s.id, funcs:count(planner__core__rule_constant_propagation.s.name)->Column#10
    │     └─Selection	cop[tikv]		gt(planner__core__rule_constant_propagation.s.id, 1), not(isnull(planner__core__rule_constant_propagation.s.id))
    │       └─TableFullScan	cop[tikv]	table:s	keep order:false, stats:pseudo
    └─TableReader(Probe)	root		data:Selection
      └─Selection	cop[tikv]		not(isnull(planner__core__rule_constant_propagation.t.id))
        └─TableFullScan	cop[tikv]	table:t	keep order:false, stats:pseudo
explain format='plan_tree' select * from t, (select id from s where s.id>1 order by id limit 2) tmp where t.id=tmp.id; -- can't, constant propagation can't through the sort node;
id	task	access object	operator info
Projection	root		planner__core__rule_constant_propagation.t.id, planner__core__rule_constant_propagation.t.name, planner__core__rule_constant_propagation.s.id
└─HashJoin	root		inner join, equal:[eq(planner__core__rule_constant_propagation.s.id, planner__core__rule_constant_propagation.t.id)]
  ├─Selection(Build)	root		not(isnull(planner__core__rule_constant_propagation.s.id))
  │ └─TopN	root		planner__core__rule_constant_propagation.s.id, offset:0, count:2
  │   └─TableReader	root		data:TopN
  │     └─TopN	cop[tikv]		planner__core__rule_constant_propagation.s.id, offset:0, count:2
  │       └─Selection	cop[tikv]		gt(planner__core__rule_constant_propagation.s.id, 1)
  │         └─TableFullScan	cop[tikv]	table:s	keep order:false, stats:pseudo
  └─TableReader(Probe)	root		data:Selection
    └─Selection	cop[tikv]		not(isnull(planner__core__rule_constant_propagation.t.id))
      └─TableFullScan	cop[tikv]	table:t	keep order:false, stats:pseudo
drop table if exists t, s;
create table t (id int, name varchar(10));
create table s (id int, name varchar(10));
explain format='plan_tree' Update t, (select * from s where s.id>1) tmp set t.name=tmp.name where t.id=tmp.id;
id	task	access object	operator info
Update	root		N/A
└─HashJoin	root		inner join, equal:[eq(planner__core__rule_constant_propagation.t.id, planner__core__rule_constant_propagation.s.id)]
  ├─TableReader(Build)	root		data:Selection
  │ └─Selection	cop[tikv]		gt(planner__core__rule_constant_propagation.s.id, 1), not(isnull(planner__core__rule_constant_propagation.s.id))
  │   └─TableFullScan	cop[tikv]	table:s	keep order:false, stats:pseudo
  └─TableReader(Probe)	root		data:Selection
    └─Selection	cop[tikv]		gt(planner__core__rule_constant_propagation.t.id, 1), not(isnull(planner__core__rule_constant_propagation.t.id))
      └─TableFullScan	cop[tikv]	table:t	keep order:false, stats:pseudo
drop table if exists t, s;
create table t (id int, name varchar(10));
create table s (id int, name varchar(10));
explain format='plan_tree' select * from (select * from (select t.id+1 as id1, t.name from t, (select * from s where s.id>1) s1 where t.id=s1.id ) tmp order by id1) a union (select tmp.* from (select * from t where t.id <3) tmp left join s on tmp.id=s.id); -- match twice;
id	task	access object	operator info
HashAgg	root		group by:Column#18, Column#19, funcs:firstrow(Column#18)->Column#18, funcs:firstrow(Column#19)->Column#19
└─Union	root		
  ├─Projection	root		plus(planner__core__rule_constant_propagation.t.id, 1)->Column#18, planner__core__rule_constant_propagation.t.name->Column#19
  │ └─HashJoin	root		inner join, equal:[eq(planner__core__rule_constant_propagation.t.id, planner__core__rule_constant_propagation.s.id)]
  │   ├─TableReader(Build)	root		data:Selection
  │   │ └─Selection	cop[tikv]		gt(planner__core__rule_constant_propagation.s.id, 1), not(isnull(planner__core__rule_constant_propagation.s.id))
  │   │   └─TableFullScan	cop[tikv]	table:s	keep order:false, stats:pseudo
  │   └─TableReader(Probe)	root		data:Selection
  │     └─Selection	cop[tikv]		gt(planner__core__rule_constant_propagation.t.id, 1), not(isnull(planner__core__rule_constant_propagation.t.id))
  │       └─TableFullScan	cop[tikv]	table:t	keep order:false, stats:pseudo
  └─Projection	root		cast(planner__core__rule_constant_propagation.t.id, bigint BINARY)->Column#18, planner__core__rule_constant_propagation.t.name->Column#19
    └─TableReader	root		data:Selection
      └─Selection	cop[tikv]		lt(planner__core__rule_constant_propagation.t.id, 3)
        └─TableFullScan	cop[tikv]	table:t	keep order:false, stats:pseudo
create table t1(id int, value int);
create table t2(id int, value int);
INSERT INTO t1 (id, value) VALUES (10, 0),(20, 0),(30, 0);
INSERT INTO t2 (id, value) VALUES (10, 100), (10, 200), (10, 300), (20, 400), (30, 500);
explain format='plan_tree' update t1 set value = (select count(*) from t2 where t1.id = t2.id) where t1.id = 10;
id	task	access object	operator info
Update	root		N/A
└─Projection	root		planner__core__rule_constant_propagation.t1.id, planner__core__rule_constant_propagation.t1.value, planner__core__rule_constant_propagation.t1._tidb_rowid, ifnull(Column#9, 0)->Column#9
  └─HashJoin	root		left outer join, left side:TableReader, equal:[eq(planner__core__rule_constant_propagation.t1.id, planner__core__rule_constant_propagation.t2.id)]
    ├─HashAgg(Build)	root		group by:planner__core__rule_constant_propagation.t2.id, funcs:count(1)->Column#9, funcs:firstrow(planner__core__rule_constant_propagation.t2.id)->planner__core__rule_constant_propagation.t2.id
    │ └─TableReader	root		data:Selection
    │   └─Selection	cop[tikv]		eq(10, planner__core__rule_constant_propagation.t2.id)
    │     └─TableFullScan	cop[tikv]	table:t2	keep order:false, stats:pseudo
    └─TableReader(Probe)	root		data:Selection
      └─Selection	cop[tikv]		eq(planner__core__rule_constant_propagation.t1.id, 10)
        └─TableFullScan	cop[tikv]	table:t1	keep order:false, stats:pseudo
update t1 set value = (select count(*) from t2 where t1.id = t2.id) where t1.id = 10;
select * from t1;
id	value
10	3
20	0
30	0
select * from t2;
id	value
10	100
10	200
10	300
20	400
30	500
drop table if exists t1, t2;
CREATE TABLE t2 (
k INT,
b INT
);
CREATE TABLE t3 (
k INT,
b INT
);
INSERT INTO t2 (k, b) VALUES
(1, 100),
(2, NULL),
(3, 300),
(NULL, 400),
(5, 500);
INSERT INTO t3 (k, b) VALUES
(1, 100),
(2, NULL),
(3, 300),
(NULL, 400),
(6, 600);
explain select * from t2 where not exists (select 1 from t3 where t3.k = t2.k and t3.b = t2.b and t2.k = 1);
id	estRows	task	access object	operator info
HashJoin_16	8000.00	root		anti semi join, left side:TableReader_19, equal:[eq(planner__core__rule_constant_propagation.t2.b, planner__core__rule_constant_propagation.t3.b) eq(planner__core__rule_constant_propagation.t2.k, planner__core__rule_constant_propagation.t3.k)], left cond:[eq(planner__core__rule_constant_propagation.t2.k, 1)]
├─TableReader_22(Build)	10.00	root		data:Selection_21
│ └─Selection_21	10.00	cop[tikv]		eq(1, planner__core__rule_constant_propagation.t3.k)
│   └─TableFullScan_20	10000.00	cop[tikv]	table:t3	keep order:false, stats:pseudo
└─TableReader_19(Probe)	10000.00	root		data:TableFullScan_18
  └─TableFullScan_18	10000.00	cop[tikv]	table:t2	keep order:false, stats:pseudo
explain select * from t2 where exists (select 1 from t3 where t3.k = t2.k and t3.b = t2.b and t2.k = 1);
id	estRows	task	access object	operator info
HashJoin_17	7.99	root		semi join, left side:TableReader_21, equal:[eq(planner__core__rule_constant_propagation.t2.b, planner__core__rule_constant_propagation.t3.b) eq(planner__core__rule_constant_propagation.t2.k, planner__core__rule_constant_propagation.t3.k)]
├─TableReader_24(Build)	9.99	root		data:Selection_23
│ └─Selection_23	9.99	cop[tikv]		eq(1, planner__core__rule_constant_propagation.t3.k), not(isnull(planner__core__rule_constant_propagation.t3.b))
│   └─TableFullScan_22	10000.00	cop[tikv]	table:t3	keep order:false, stats:pseudo
└─TableReader_21(Probe)	9.99	root		data:Selection_20
  └─Selection_20	9.99	cop[tikv]		eq(planner__core__rule_constant_propagation.t2.k, 1), not(isnull(planner__core__rule_constant_propagation.t2.b))
    └─TableFullScan_19	10000.00	cop[tikv]	table:t2	keep order:false, stats:pseudo
EXPLAIN SELECT * FROM t2
WHERE NOT EXISTS (
SELECT 1 FROM t3
WHERE t3.k = t2.k AND t3.b = t2.b
)
AND t2.k = 1;
id	estRows	task	access object	operator info
HashJoin_17	8.00	root		anti semi join, left side:TableReader_21, equal:[eq(planner__core__rule_constant_propagation.t2.b, planner__core__rule_constant_propagation.t3.b) eq(planner__core__rule_constant_propagation.t2.k, planner__core__rule_constant_propagation.t3.k)]
├─TableReader_24(Build)	10.00	root		data:Selection_23
│ └─Selection_23	10.00	cop[tikv]		eq(1, planner__core__rule_constant_propagation.t3.k)
│   └─TableFullScan_22	10000.00	cop[tikv]	table:t3	keep order:false, stats:pseudo
└─TableReader_21(Probe)	10.00	root		data:Selection_20
  └─Selection_20	10.00	cop[tikv]		eq(planner__core__rule_constant_propagation.t2.k, 1)
    └─TableFullScan_19	10000.00	cop[tikv]	table:t2	keep order:false, stats:pseudo
SELECT * FROM t2
WHERE NOT EXISTS (
SELECT 1 FROM t3
WHERE t3.k = t2.k AND t3.b = t2.b
)
AND t2.k = 1;
k	b
EXPLAIN SELECT * FROM t2
WHERE EXISTS (
SELECT 1 FROM t3
WHERE t3.k = t2.k AND t3.b = t2.b
)
AND t2.k = 1;
id	estRows	task	access object	operator info
HashJoin_17	7.99	root		semi join, left side:TableReader_21, equal:[eq(planner__core__rule_constant_propagation.t2.b, planner__core__rule_constant_propagation.t3.b) eq(planner__core__rule_constant_propagation.t2.k, planner__core__rule_constant_propagation.t3.k)]
├─TableReader_24(Build)	9.99	root		data:Selection_23
│ └─Selection_23	9.99	cop[tikv]		eq(1, planner__core__rule_constant_propagation.t3.k), not(isnull(planner__core__rule_constant_propagation.t3.b))
│   └─TableFullScan_22	10000.00	cop[tikv]	table:t3	keep order:false, stats:pseudo
└─TableReader_21(Probe)	9.99	root		data:Selection_20
  └─Selection_20	9.99	cop[tikv]		eq(planner__core__rule_constant_propagation.t2.k, 1), not(isnull(planner__core__rule_constant_propagation.t2.b))
    └─TableFullScan_19	10000.00	cop[tikv]	table:t2	keep order:false, stats:pseudo
SELECT * FROM t2
WHERE NOT EXISTS (
SELECT 1 FROM t3
WHERE t3.k = t2.k AND t3.b = t2.b
)
AND t2.k = 1;
k	b
SELECT * FROM t2
WHERE NOT EXISTS (
SELECT 1 FROM t3
WHERE t3.k = t2.k AND t3.b = t2.b AND t2.k = 1
);
k	b
2	NULL
3	300
NULL	400
5	500
DELETE FROM t3 WHERE k = 1 AND b = 100;
SELECT * FROM t2
WHERE EXISTS (
SELECT 1 FROM t3
WHERE t3.k = t2.k AND t3.b = t2.b
)
AND t2.k = 1;
k	b
SELECT * FROM t2
WHERE NOT EXISTS (
SELECT 1 FROM t3
WHERE t3.k = t2.k AND t3.b = t2.b
)
AND t2.k = 1;
k	b
1	100
SELECT * FROM t2
WHERE EXISTS (
SELECT 1 FROM t3
WHERE t3.k = t2.k AND t3.b = t2.b
)
AND t2.k = 1;
k	b
SELECT * FROM t2
WHERE NOT EXISTS (
SELECT 1 FROM t3
WHERE t3.k = t2.k AND t3.b = t2.b AND t2.k = 1
);
k	b
1	100
2	NULL
3	300
NULL	400
5	500
SELECT * FROM t2
WHERE EXISTS (
SELECT 1 FROM t3
WHERE t3.k = t2.k AND t3.b = t2.b AND t2.k = 1
);
k	b
