drop table if exists test_global;
create table test_global ( a int, b int, c int, unique key p_b(b) global)
partition by range( a ) (
partition p1 values less than (10),
partition p2 values less than (20)
);
insert into test_global values (1,2,2);
insert into test_global values (11,2,2);
Error 1062 (23000): Duplicate entry '2' for key 'test_global.p_b'
insert into test_global values (11,2,2);
Error 1062 (23000): Duplicate entry '2' for key 'test_global.p_b'
# NULL will not get 'duplicate key' error here
insert into test_global(a,c) values (1,2);
insert into test_global(a,c) values (11,2);
drop table if exists test_global;
create table test_global ( a int, b int, c int, primary key p_b(b) /*T![clustered_index] CLUSTERED */ GLOBAL)
partition by range( a ) (
partition p1 values less than (10),
partition p2 values less than (20)
);
Error 8200 (HY000): Unsupported create an index that is both a global index and a clustered index
drop table if exists test_global;
create table test_global ( a int, b int, c int, primary key p_b_c(b, c) /*T![clustered_index] CLUSTERED */ GLOBAL)
partition by range( a ) (
partition p1 values less than (10),
partition p2 values less than (20)
);
Error 8200 (HY000): Unsupported create an index that is both a global index and a clustered index
drop table if exists test_global;
create table test_global ( a int, b int, c int, primary key (b) /*T![clustered_index] NONCLUSTERED */ GLOBAL)
partition by range( a ) (
partition p1 values less than (10),
partition p2 values less than (20)
);
insert into test_global values (1,2,2);
insert into test_global values (11,2,2);
Error 1062 (23000): Duplicate entry '2' for key 'test_global.PRIMARY'
insert into test_global values (11,2,2);
Error 1062 (23000): Duplicate entry '2' for key 'test_global.PRIMARY'
drop table if exists p;
create table p (a int, b int GENERATED ALWAYS AS (3*a-2*a) VIRTUAL, unique index idx(a) global) partition by hash(b) partitions 2;
insert into p (a) values  (1),(2),(3);
analyze table p;
select * from p use index (idx);
a	b
1	1
2	2
3	3
drop table if exists test_t1;
CREATE TABLE test_t1 (
a int(11) NOT NULL,
b int(11) DEFAULT NULL,
c int(11) DEFAULT NULL,
unique index p_a(a) global
) ENGINE=InnoDB DEFAULT CHARSET=utf8mb4 COLLATE=utf8mb4_bin
PARTITION BY RANGE (c) (
PARTITION p0 VALUES LESS THAN (10),
PARTITION p1 VALUES LESS THAN (MAXVALUE)
);
insert into test_t1 values (1,1,1);
explain format='brief' select * from test_t1 where a = 1;
id	estRows	task	access object	operator info
Point_Get	1.00	root	table:test_t1, index:p_a(a)	
select * from test_t1 where a = 1;
a	b	c
1	1	1
analyze table test_t1;
explain format='brief' select * from test_t1 where a = 1;
id	estRows	task	access object	operator info
Point_Get	1.00	root	table:test_t1, index:p_a(a)	
select * from test_t1 where a = 1;
a	b	c
1	1	1
drop table if exists t;
create table t (a varchar(10), b varchar(1) GENERATED ALWAYS AS (substr(a,1,1)) VIRTUAL, unique index (a) global) partition by list columns(b) (partition p0 values in ('a','c'), partition p1 values in ('b','d'));
insert into t (a) values  ('aaa'),('abc'),('acd');
analyze table t;
select a from t partition (p0) order by a;
a
aaa
abc
acd
select * from t where a = 'abc' order by a;
a	b
abc	a
update t set a='bbb' where a = 'aaa';
admin check table t;
select a from t order by a;
a
abc
acd
bbb
select a from t partition (p0) order by a;
a
abc
acd
select a from t partition (p1) order by a;
a
bbb
select * from t where a = 'bbb' order by a;
a	b
bbb	b
insert into t (a) values  ('abc');
Error 1062 (23000): Duplicate entry 'abc' for key 't.a'
insert into t (a) values ('abc') on duplicate key update a='bbc';
select a from t order by a;
a
acd
bbb
bbc
select * from t where a = 'bbc';
a	b
bbc	b
select a from t partition (p0) order by a;
a
acd
select a from t partition (p1) order by a;
a
bbb
bbc
explain format = 'brief' select a from t partition (p1) order by a;
id	estRows	task	access object	operator info
IndexReader	3.00	root	partition:p1	index:Selection
└─Selection	3.00	cop[tikv]	NULL	in(_tidb_tid, tid1)
  └─IndexFullScan	3.00	cop[tikv]	table:t, index:a(a)	keep order:true
drop table if exists t;
create table t (a varchar(10), b varchar(1) GENERATED ALWAYS AS (substr(a,1,1)) STORED, unique index (a) global) partition by list columns(b) (partition p0 values in ('a','c'), partition p1 values in ('b','d'));
insert into t (a) values  ('aaa'),('abc'),('acd');
analyze table t;
select a from t partition (p0) order by a;
a
aaa
abc
acd
select * from t where a = 'abc' order by a;
a	b
abc	a
update t set a='bbb' where a = 'aaa';
admin check table t;
select a from t order by a;
a
abc
acd
bbb
select a from t partition (p0) order by a;
a
abc
acd
select a from t partition (p1) order by a;
a
bbb
select * from t where a = 'bbb' order by a;
a	b
bbb	b
insert into t (a) values  ('abc');
Error 1062 (23000): Duplicate entry 'abc' for key 't.a'
insert into t (a) values ('abc') on duplicate key update a='bbc';
select a from t order by a;
a
acd
bbb
bbc
select * from t where a = 'bbc';
a	b
bbc	b
select a from t partition (p0) order by a;
a
acd
select a from t partition (p1) order by a;
a
bbb
bbc
explain format = 'brief' select a from t partition (p1) order by a;
id	estRows	task	access object	operator info
IndexReader	3.00	root	partition:p1	index:Selection
└─Selection	3.00	cop[tikv]	NULL	in(_tidb_tid, tid1)
  └─IndexFullScan	3.00	cop[tikv]	table:t, index:a(a)	keep order:true
drop table if exists t;
create table t (a int, b int, unique key idx_b (b)) partition by hash (a) partitions 3;
Error 8264 (HY000): Global Index is needed for index 'idx_b', since the unique index is not including all partitioning columns, and GLOBAL is not given as IndexOption
create table t (a int, b int, unique key idx_b (b) local) partition by hash (a) partitions 3;
Error 8264 (HY000): Global Index is needed for index 'idx_b', since the unique index is not including all partitioning columns, and GLOBAL is not given as IndexOption
create table t (a int, b int, unique key idx_b (b) global) partition by hash (a) partitions 3;
show create table t;
Table	Create Table
t	CREATE TABLE `t` (
  `a` int DEFAULT NULL,
  `b` int DEFAULT NULL,
  UNIQUE KEY `idx_b` (`b`) /*T![global_index] GLOBAL */
) ENGINE=InnoDB DEFAULT CHARSET=utf8mb4 COLLATE=utf8mb4_bin
PARTITION BY HASH (`a`) PARTITIONS 3
drop table t;
CREATE TABLE `t` (
`a` int(11) DEFAULT NULL,
`b` int(11) DEFAULT NULL,
UNIQUE KEY `idx_b` (`b`) /*T![global_index] GLOBAL */
) ENGINE=InnoDB DEFAULT CHARSET=utf8mb4 COLLATE=utf8mb4_bin
PARTITION BY HASH (`a`) PARTITIONS 3;
show create table t;
Table	Create Table
t	CREATE TABLE `t` (
  `a` int DEFAULT NULL,
  `b` int DEFAULT NULL,
  UNIQUE KEY `idx_b` (`b`) /*T![global_index] GLOBAL */
) ENGINE=InnoDB DEFAULT CHARSET=utf8mb4 COLLATE=utf8mb4_bin
PARTITION BY HASH (`a`) PARTITIONS 3
alter table t partition by key (b) partitions 3;
alter table t partition by key (b) partitions 3 update indexes (idx_b GLOBAL);
alter table t partition by key (b) partitions 3 update indexes (idx_b LOCAL);
alter table t partition by hash (a) partitions 3 update indexes (idx_b LOCAL);
Error 8264 (HY000): Global Index is needed for index 'idx_b', since the unique index is not including all partitioning columns, and GLOBAL is not given as IndexOption
alter table t partition by hash (a) partitions 3 update indexes (idx_b GLOBAL);
show create table t;
Table	Create Table
t	CREATE TABLE `t` (
  `a` int DEFAULT NULL,
  `b` int DEFAULT NULL,
  UNIQUE KEY `idx_b` (`b`) /*T![global_index] GLOBAL */
) ENGINE=InnoDB DEFAULT CHARSET=utf8mb4 COLLATE=utf8mb4_bin
PARTITION BY HASH (`a`) PARTITIONS 3
alter table t partition by hash (b) partitions 3 update indexes(idx_b global);
alter table t partition by hash (b) partitions 3 update indexes(idx_b local);
show create table t;
Table	Create Table
t	CREATE TABLE `t` (
  `a` int DEFAULT NULL,
  `b` int DEFAULT NULL,
  UNIQUE KEY `idx_b` (`b`)
) ENGINE=InnoDB DEFAULT CHARSET=utf8mb4 COLLATE=utf8mb4_bin
PARTITION BY HASH (`b`) PARTITIONS 3
alter table t partition by key (b) partitions 3;
show create table t;
Table	Create Table
t	CREATE TABLE `t` (
  `a` int DEFAULT NULL,
  `b` int DEFAULT NULL,
  UNIQUE KEY `idx_b` (`b`)
) ENGINE=InnoDB DEFAULT CHARSET=utf8mb4 COLLATE=utf8mb4_bin
PARTITION BY KEY (`b`) PARTITIONS 3
drop table t;
drop table if exists t;
create table t (a int, b varchar(255), c varchar (255), primary key (a,b), unique key (c) global) partition by list columns (a,b) (partition p0 values in ((1,"1"),(2,"2"),(3,"3")), partition p1 values in ((100,"100"),(101,"101"),(102,"102"),DEFAULT));
insert into t values (1,1,1),(2,2,2),(101,101,101),(102,102,102);
select * from t;
a	b	c
1	1	1
101	101	101
102	102	102
2	2	2
