use test;
drop table if exists in_signed_source, in_signed_forward, in_signed_reverse, in_signed_reference;
create table in_signed_source (id int primary key, u bigint unsigned, tag varchar(20));
insert into in_signed_source values (1,0,'zero'),(2,1,'one'),(3,18446744073709551615,'protected-a'),(4,18446744073709551615,'protected-b'),(5,null,'null');
set @@tidb_enable_vectorized_expression=0;
select id,u in (-1,18446744073709551615),u in (18446744073709551615,-1),(u=-1 or u=18446744073709551615) from in_signed_source order by id;
id	u in (-1,18446744073709551615)	u in (18446744073709551615,-1)	(u=-1 or u=18446744073709551615)
1	0	0	0
2	0	0	0
3	1	1	1
4	1	1	1
5	NULL	NULL	NULL
set @@tidb_enable_vectorized_expression=1;
select id,u in (-1,18446744073709551615),u in (18446744073709551615,-1),(u=-1 or u=18446744073709551615) from in_signed_source order by id;
id	u in (-1,18446744073709551615)	u in (18446744073709551615,-1)	(u=-1 or u=18446744073709551615)
1	0	0	0
2	0	0	0
3	1	1	1
4	1	1	1
5	NULL	NULL	NULL
create table in_signed_forward like in_signed_source;
create table in_signed_reverse like in_signed_source;
create table in_signed_reference like in_signed_source;
insert into in_signed_forward select * from in_signed_source;
insert into in_signed_reverse select * from in_signed_source;
insert into in_signed_reference select * from in_signed_source;
delete from in_signed_forward where u not in (-1,18446744073709551615);
delete from in_signed_reverse where u not in (18446744073709551615,-1);
delete from in_signed_reference where not (u=-1 or u=18446744073709551615);
select * from in_signed_forward order by id;
id	u	tag
3	18446744073709551615	protected-a
4	18446744073709551615	protected-b
5	NULL	null
select * from in_signed_reverse order by id;
id	u	tag
3	18446744073709551615	protected-a
4	18446744073709551615	protected-b
5	NULL	null
select * from in_signed_reference order by id;
id	u	tag
3	18446744073709551615	protected-a
4	18446744073709551615	protected-b
5	NULL	null
admin check table in_signed_forward;
admin check table in_signed_reverse;
admin check table in_signed_reference;
set @@tidb_enable_vectorized_expression=default;
drop table in_signed_source,in_signed_forward,in_signed_reverse,in_signed_reference;
