set tidb_enable_global_index=true;
drop table if exists p;
create table p (id int, c int) partition by range (c) (
partition p0 values less than (4),
partition p1 values less than (7),
partition p2 values less than (10));
alter table p add unique idx(id);
insert into p values (1,3), (3,4), (5,6), (7,9);
analyze table p;
drop table if exists t;
create table t (id int, c int);
insert into t values (1, 3);
analyze table t;
select id from p use index (idx) order by id;
id
1
3
5
7
select * from p use index (idx);
id	c
1	3
3	4
5	6
7	9
select count(*) from p use index (idx);
count(*)
4
select count(*) from p partition(p0) use index (idx);
count(*)
1
select * from p partition(p0) use index (idx);
id	c
1	3
select id from p partition(p0) use index (idx);
id
1
select /*+ INL_JOIN(p, t) */ * from p inner join t on p.id = t.id;
id	c	id	c
1	3	1	3
select /*+ INL_JOIN(p, t) */ p.id from p inner join t on p.id = t.id;
id
1
select /*+ INL_JOIN(p, t) */ * from p partition(p0) inner join t on p.id = t.id;
id	c	id	c
1	3	1	3
select /*+ INL_JOIN(p, t) */ p.id from p partition(p0) inner join t on p.id = t.id;
id
1
drop table if exists p, t;
create table p (id int, c int, d int, e int, primary key(d, c) clustered) partition by range (c) (
partition p0 values less than (4),
partition p1 values less than (7),
partition p2 values less than (10));
alter table p add unique idx(id);
insert into p values (1,3,1,1), (3,4,3,3), (5,6,5,5), (7,9,7,7);
analyze table p;
create table t (id int, c int);
insert into t values (1, 3);
analyze table t;
select id from p partition(p0) use index (idx);
id
1
select /*+ INL_JOIN(p, t) */ * from p partition(p0) inner join t on p.id = t.id;
id	c	d	e	id	c
1	3	1	1	1	3
select /*+ INL_JOIN(p, t) */ p.id from p partition(p0) inner join t on p.id = t.id;
id
1
drop table if exists p;
create table p (a int, b int GENERATED ALWAYS AS (3*a-2*a) VIRTUAL) partition by hash(b) partitions 2;
alter table p add unique index idx (a);
insert into p (a) values  (1),(2),(3);
analyze table p;
select * from p use index (idx);
a	b
1	1
2	2
3	3
drop table if exists test_t1;
CREATE TABLE test_t1 (
a int(11) NOT NULL,
b int(11) DEFAULT NULL,
c int(11) DEFAULT NULL
) ENGINE=InnoDB DEFAULT CHARSET=utf8mb4 COLLATE=utf8mb4_bin
PARTITION BY RANGE (c) (
PARTITION p0 VALUES LESS THAN (10),
PARTITION p1 VALUES LESS THAN (MAXVALUE)
);
alter table test_t1 add unique  p_a (a);
insert into test_t1 values (1,1,1);
explain format='brief' select * from test_t1 where a = 1;
id	estRows	task	access object	operator info
Point_Get	1.00	root	table:test_t1, index:p_a(a)	
select * from test_t1 where a = 1;
a	b	c
1	1	1
analyze table test_t1;
explain format='brief' select * from test_t1 where a = 1;
id	estRows	task	access object	operator info
Point_Get	1.00	root	table:test_t1, index:p_a(a)	
select * from test_t1 where a = 1;
a	b	c
1	1	1
SET session tidb_enable_index_merge = ON;
drop table if exists t;
CREATE TABLE t (
a int(11) NOT NULL,
b int(11) DEFAULT NULL,
c int(11) DEFAULT NULL,
d int(11) NOT NULL AUTO_INCREMENT,
KEY idx_bd (b, c),
UNIQUE KEY uidx_ac(a)
) ENGINE=InnoDB DEFAULT CHARSET=utf8mb4 COLLATE=utf8mb4_bin
PARTITION BY RANGE (c) (
PARTITION p0 VALUES LESS THAN (10),
PARTITION p1 VALUES LESS THAN (MAXVALUE)
);
insert into t values (1,1,1,1),(2,2,2,2),(3,3,3,3),(4,4,4,4),(5,5,5,5),(6,6,6,6),(7,7,7,7),(8,8,8,8);
analyze table t;
# when index_merge has global index as its partial path, ignore it.
explain select /*+ use_index_merge(t, uidx_ac, idx_bc) */ * from t where a=1 or b=2;
id	estRows	task	access object	operator info
TableReader_7	1.88	root	partition:all	data:Selection_6
└─Selection_6	1.88	cop[tikv]		or(eq(executor__partition__global_index.t.a, 1), eq(executor__partition__global_index.t.b, 2))
  └─TableFullScan_5	8.00	cop[tikv]	table:t	keep order:false
select /*+ use_index_merge(t, uidx_ac, idx_bc) */ * from t where a=1 or b=2;
a	b	c	d
1	1	1	1
2	2	2	2
SET session tidb_enable_index_merge = DEFAULT;
drop table if exists t;
create table t (a varchar(10), b varchar(1) GENERATED ALWAYS AS (substr(a,1,1)) VIRTUAL) partition by list columns(b) (partition p0 values in ('a','c'), partition p1 values in ('b','d'));
alter table t add unique index (a);
insert into t (a) values  ('aaa'),('abc'),('acd');
analyze table t;
select a from t partition (p0) order by a;
a
aaa
abc
acd
select * from t where a = 'abc' order by a;
a	b
abc	a
update t set a='bbb' where a = 'aaa';
admin check table t;
select a from t order by a;
a
abc
acd
bbb
select a from t partition (p0) order by a;
a
abc
acd
select a from t partition (p1) order by a;
a
bbb
select * from t where a = 'bbb' order by a;
a	b
bbb	b
insert into t (a) values  ('abc');
Error 1062 (23000): Duplicate entry 'abc' for key 't.a'
insert into t (a) values ('abc') on duplicate key update a='bbc';
select a from t order by a;
a
acd
bbb
bbc
select * from t where a = 'bbc';
a	b
bbc	b
select a from t partition (p0) order by a;
a
acd
select a from t partition (p1) order by a;
a
bbb
bbc
explain format = 'brief' select a from t partition (p1) order by a;
id	estRows	task	access object	operator info
IndexReader	3.00	root	partition:p1	index:IndexFullScan
└─IndexFullScan	3.00	cop[tikv]	table:t, index:a(a)	keep order:true
drop table if exists t;
create table t (a varchar(10), b varchar(1) GENERATED ALWAYS AS (substr(a,1,1)) STORED) partition by list columns(b) (partition p0 values in ('a','c'), partition p1 values in ('b','d'));
alter table t add unique index (a);
insert into t (a) values  ('aaa'),('abc'),('acd');
analyze table t;
select a from t partition (p0) order by a;
a
aaa
abc
acd
select * from t where a = 'abc' order by a;
a	b
abc	a
update t set a='bbb' where a = 'aaa';
admin check table t;
select a from t order by a;
a
abc
acd
bbb
select a from t partition (p0) order by a;
a
abc
acd
select a from t partition (p1) order by a;
a
bbb
select * from t where a = 'bbb' order by a;
a	b
bbb	b
insert into t (a) values  ('abc');
Error 1062 (23000): Duplicate entry 'abc' for key 't.a'
insert into t (a) values ('abc') on duplicate key update a='bbc';
select a from t order by a;
a
acd
bbb
bbc
select * from t where a = 'bbc';
a	b
bbc	b
select a from t partition (p0) order by a;
a
acd
select a from t partition (p1) order by a;
a
bbb
bbc
explain format = 'brief' select a from t partition (p1) order by a;
id	estRows	task	access object	operator info
IndexReader	3.00	root	partition:p1	index:IndexFullScan
└─IndexFullScan	3.00	cop[tikv]	table:t, index:a(a)	keep order:true
