set tidb_cost_model_version=1;
///// SUBQUERY
drop table if exists t1;
create table t1(c1 int, c2 int, c3 int, key(c1), key(c2));
insert into t1 values(1, 1, 1), (2, 2, 2), (3, 3, 3), (4, 4, 4), (5, 5, 5);
drop table if exists t2;
create table t2(c1 int, c2 int, c3 int, key(c1), key(c2));
insert into t2 values(1, 1, 1), (2, 2, 2), (3, 3, 3), (4, 4, 4), (5, 5, 5);
// IN
explain format = 'plan_tree' select /*+ use_index_merge(t1) */ * from t1 where c1 < 10 or c2 < 10 and c3 in (select c3 from t1) order by 1;
id	task	access object	operator info
Sort	root		index_merge.t1.c1
└─Projection	root		index_merge.t1.c1, index_merge.t1.c2, index_merge.t1.c3
  └─Selection	root		or(lt(index_merge.t1.c1, 10), and(lt(index_merge.t1.c2, 10), Column))
    └─HashJoin	root		CARTESIAN left outer semi join, left side:IndexMerge, other cond:eq(index_merge.t1.c3, index_merge.t1.c3)
      ├─TableReader(Build)	root		data:TableFullScan
      │ └─TableFullScan	cop[tikv]	table:t1	keep order:false, stats:pseudo
      └─IndexMerge(Probe)	root		type: union
        ├─IndexRangeScan(Build)	cop[tikv]	table:t1, index:c1(c1)	range:[-inf,10), keep order:false, stats:pseudo
        ├─IndexRangeScan(Build)	cop[tikv]	table:t1, index:c2(c2)	range:[-inf,10), keep order:false, stats:pseudo
        └─TableRowIDScan(Probe)	cop[tikv]	table:t1	keep order:false, stats:pseudo
select /*+ use_index_merge(t1) */ * from t1 where c1 < 10 or c2 < 10 and c3 in (select c3 from t1) order by 1;
c1	c2	c3
1	1	1
2	2	2
3	3	3
4	4	4
5	5	5
// NOT IN
explain format = 'plan_tree' select /*+ use_index_merge(t1) */ * from t1 where c1 < 10 or c2 < 10 and c3 not in (select c3 from t1) order by 1;
id	task	access object	operator info
Sort	root		index_merge.t1.c1
└─Projection	root		index_merge.t1.c1, index_merge.t1.c2, index_merge.t1.c3
  └─Selection	root		or(lt(index_merge.t1.c1, 10), and(lt(index_merge.t1.c2, 10), Column))
    └─HashJoin	root		Null-aware anti left outer semi join, left side:IndexMerge, equal:[eq(index_merge.t1.c3, index_merge.t1.c3)]
      ├─TableReader(Build)	root		data:TableFullScan
      │ └─TableFullScan	cop[tikv]	table:t1	keep order:false, stats:pseudo
      └─IndexMerge(Probe)	root		type: union
        ├─IndexRangeScan(Build)	cop[tikv]	table:t1, index:c1(c1)	range:[-inf,10), keep order:false, stats:pseudo
        ├─IndexRangeScan(Build)	cop[tikv]	table:t1, index:c2(c2)	range:[-inf,10), keep order:false, stats:pseudo
        └─TableRowIDScan(Probe)	cop[tikv]	table:t1	keep order:false, stats:pseudo
select /*+ use_index_merge(t1) */ * from t1 where c1 < 10 or c2 < 10 and c3 not in (select c3 from t1) order by 1;
c1	c2	c3
1	1	1
2	2	2
3	3	3
4	4	4
5	5	5
// MAX
explain format = 'plan_tree' select /*+ use_index_merge(t1) */ * from t1 where c1 < 10 or c2 < 10 and c3 = (select max(c3) from t1) order by 1;
id	task	access object	operator info
Sort	root		index_merge.t1.c1
└─IndexMerge	root		type: union
  ├─IndexRangeScan(Build)	cop[tikv]	table:t1, index:c1(c1)	range:[-inf,10), keep order:false, stats:pseudo
  ├─IndexRangeScan(Build)	cop[tikv]	table:t1, index:c2(c2)	range:[-inf,10), keep order:false, stats:pseudo
  └─Selection(Probe)	cop[tikv]		or(lt(index_merge.t1.c1, 10), and(lt(index_merge.t1.c2, 10), eq(index_merge.t1.c3, ScalarQueryCol#10(5))))
    └─TableRowIDScan	cop[tikv]	table:t1	keep order:false, stats:pseudo
ScalarSubQuery	root		Output: ScalarQueryCol#10
└─MaxOneRow	root		
  └─StreamAgg	root		funcs:max(index_merge.t1.c3)->Column
    └─TopN	root		index_merge.t1.c3:desc, offset:0, count:1
      └─TableReader	root		data:TopN
        └─TopN	cop[tikv]		index_merge.t1.c3:desc, offset:0, count:1
          └─Selection	cop[tikv]		not(isnull(index_merge.t1.c3))
            └─TableFullScan	cop[tikv]	table:t1	keep order:false, stats:pseudo
select /*+ use_index_merge(t1) */ * from t1 where c1 < 10 or c2 < 10 and c3 = (select max(c3) from t1) order by 1;
c1	c2	c3
1	1	1
2	2	2
3	3	3
4	4	4
5	5	5
// EXISTS
explain format = 'plan_tree' select /*+ use_index_merge(t1) */ * from t1 where c1 < 10 or c2 < 10 and EXISTS(select 1 from t2 where t2.c1 = t1.c1) order by 1;
id	task	access object	operator info
Sort	root		index_merge.t1.c1
└─Projection	root		index_merge.t1.c1, index_merge.t1.c2, index_merge.t1.c3
  └─Selection	root		or(lt(index_merge.t1.c1, 10), and(lt(index_merge.t1.c2, 10), Column))
    └─HashJoin	root		left outer semi join, left side:IndexMerge, equal:[eq(index_merge.t1.c1, index_merge.t2.c1)]
      ├─IndexReader(Build)	root		index:IndexFullScan
      │ └─IndexFullScan	cop[tikv]	table:t2, index:c1(c1)	keep order:false, stats:pseudo
      └─IndexMerge(Probe)	root		type: union
        ├─IndexRangeScan(Build)	cop[tikv]	table:t1, index:c1(c1)	range:[-inf,10), keep order:false, stats:pseudo
        ├─IndexRangeScan(Build)	cop[tikv]	table:t1, index:c2(c2)	range:[-inf,10), keep order:false, stats:pseudo
        └─TableRowIDScan(Probe)	cop[tikv]	table:t1	keep order:false, stats:pseudo
select /*+ use_index_merge(t1) */ * from t1 where c1 < 10 or c2 < 10 and EXISTS(select 1 from t2 where t2.c1 = t1.c1) order by 1;
c1	c2	c3
1	1	1
2	2	2
3	3	3
4	4	4
5	5	5
// EXISTS
explain format = 'plan_tree' select /*+ use_index_merge(t1) */ * from t1 where c1 < 10 or c2 < 10 and NOT EXISTS(select 1 from t2 where t2.c1 = t1.c1) order by 1;
id	task	access object	operator info
Sort	root		index_merge.t1.c1
└─Projection	root		index_merge.t1.c1, index_merge.t1.c2, index_merge.t1.c3
  └─Selection	root		or(lt(index_merge.t1.c1, 10), and(lt(index_merge.t1.c2, 10), Column))
    └─HashJoin	root		anti left outer semi join, left side:IndexMerge, equal:[eq(index_merge.t1.c1, index_merge.t2.c1)]
      ├─IndexReader(Build)	root		index:IndexFullScan
      │ └─IndexFullScan	cop[tikv]	table:t2, index:c1(c1)	keep order:false, stats:pseudo
      └─IndexMerge(Probe)	root		type: union
        ├─IndexRangeScan(Build)	cop[tikv]	table:t1, index:c1(c1)	range:[-inf,10), keep order:false, stats:pseudo
        ├─IndexRangeScan(Build)	cop[tikv]	table:t1, index:c2(c2)	range:[-inf,10), keep order:false, stats:pseudo
        └─TableRowIDScan(Probe)	cop[tikv]	table:t1	keep order:false, stats:pseudo
select /*+ use_index_merge(t1) */ * from t1 where c1 < 10 or c2 < 10 and NOT EXISTS(select 1 from t2 where t2.c1 = t1.c1) order by 1;
c1	c2	c3
1	1	1
2	2	2
3	3	3
4	4	4
5	5	5
// Non-Correlated
explain format = 'plan_tree' select /*+ use_index_merge(t1) */ * from t1 where c1 < 10 or c2 < 10 and c3 = (select count(1) from t2) order by 1;
id	task	access object	operator info
Sort	root		index_merge.t1.c1
└─IndexMerge	root		type: union
  ├─IndexRangeScan(Build)	cop[tikv]	table:t1, index:c1(c1)	range:[-inf,10), keep order:false, stats:pseudo
  ├─IndexRangeScan(Build)	cop[tikv]	table:t1, index:c2(c2)	range:[-inf,10), keep order:false, stats:pseudo
  └─Selection(Probe)	cop[tikv]		or(lt(index_merge.t1.c1, 10), and(lt(index_merge.t1.c2, 10), eq(index_merge.t1.c3, ScalarQueryCol#20(5))))
    └─TableRowIDScan	cop[tikv]	table:t1	keep order:false, stats:pseudo
ScalarSubQuery	root		Output: ScalarQueryCol#20
└─MaxOneRow	root		
  └─StreamAgg	root		funcs:count(Column)->Column
    └─IndexReader	root		index:StreamAgg
      └─StreamAgg	cop[tikv]		funcs:count(1)->Column
        └─IndexFullScan	cop[tikv]	table:t2, index:c1(c1)	keep order:false, stats:pseudo
select /*+ use_index_merge(t1) */ * from t1 where c1 < 10 or c2 < 10 and c3 = (select count(1) from t2) order by 1;
c1	c2	c3
1	1	1
2	2	2
3	3	3
4	4	4
5	5	5
// ANY
explain format = 'plan_tree' select /*+ use_index_merge(t1) */ * from t1 where c1 < 10 or c2 < 10 and c3 > ANY(select count(1) from t2) order by 1;
id	task	access object	operator info
Sort	root		index_merge.t1.c1
└─HashJoin	root		CARTESIAN inner join, other cond:or(lt(index_merge.t1.c1, 10), and(and(lt(index_merge.t1.c2, 10), or(gt(index_merge.t1.c3, Column), if(ne(Column, 0), NULL, 0))), and(ne(Column, 0), if(isnull(index_merge.t1.c3), NULL, 1))))
  ├─StreamAgg(Build)	root		funcs:min(Column)->Column, funcs:sum(0)->Column, funcs:count(1)->Column
  │ └─StreamAgg	root		funcs:count(Column)->Column
  │   └─IndexReader	root		index:StreamAgg
  │     └─StreamAgg	cop[tikv]		funcs:count(1)->Column
  │       └─IndexFullScan	cop[tikv]	table:t2, index:c1(c1)	keep order:false, stats:pseudo
  └─IndexMerge(Probe)	root		type: union
    ├─IndexRangeScan(Build)	cop[tikv]	table:t1, index:c1(c1)	range:[-inf,10), keep order:false, stats:pseudo
    ├─IndexRangeScan(Build)	cop[tikv]	table:t1, index:c2(c2)	range:[-inf,10), keep order:false, stats:pseudo
    └─Selection(Probe)	cop[tikv]		or(lt(index_merge.t1.c1, 10), and(lt(index_merge.t1.c2, 10), if(isnull(index_merge.t1.c3), NULL, 1)))
      └─TableRowIDScan	cop[tikv]	table:t1	keep order:false, stats:pseudo
select /*+ use_index_merge(t1) */ * from t1 where c1 < 10 or c2 < 10 and c3 > ANY(select count(1) from t2) order by 1;
c1	c2	c3
1	1	1
2	2	2
3	3	3
4	4	4
5	5	5
// SOME
explain format = 'plan_tree' select /*+ use_index_merge(t1) */ * from t1 where c1 < 10 or c2 < 10 and c3 > SOME(select count(1) from t2) order by 1;
id	task	access object	operator info
Sort	root		index_merge.t1.c1
└─HashJoin	root		CARTESIAN inner join, other cond:or(lt(index_merge.t1.c1, 10), and(and(lt(index_merge.t1.c2, 10), or(gt(index_merge.t1.c3, Column), if(ne(Column, 0), NULL, 0))), and(ne(Column, 0), if(isnull(index_merge.t1.c3), NULL, 1))))
  ├─StreamAgg(Build)	root		funcs:min(Column)->Column, funcs:sum(0)->Column, funcs:count(1)->Column
  │ └─StreamAgg	root		funcs:count(Column)->Column
  │   └─IndexReader	root		index:StreamAgg
  │     └─StreamAgg	cop[tikv]		funcs:count(1)->Column
  │       └─IndexFullScan	cop[tikv]	table:t2, index:c1(c1)	keep order:false, stats:pseudo
  └─IndexMerge(Probe)	root		type: union
    ├─IndexRangeScan(Build)	cop[tikv]	table:t1, index:c1(c1)	range:[-inf,10), keep order:false, stats:pseudo
    ├─IndexRangeScan(Build)	cop[tikv]	table:t1, index:c2(c2)	range:[-inf,10), keep order:false, stats:pseudo
    └─Selection(Probe)	cop[tikv]		or(lt(index_merge.t1.c1, 10), and(lt(index_merge.t1.c2, 10), if(isnull(index_merge.t1.c3), NULL, 1)))
      └─TableRowIDScan	cop[tikv]	table:t1	keep order:false, stats:pseudo
select /*+ use_index_merge(t1) */ * from t1 where c1 < 10 or c2 < 10 and c3 > SOME(select count(1) from t2) order by 1;
c1	c2	c3
1	1	1
2	2	2
3	3	3
4	4	4
5	5	5
// ALL
explain format = 'plan_tree' select /*+ use_index_merge(t1) */ * from t1 where c1 < 10 or c2 < 10 and c3 > ALL(select count(1) from t2) order by 1;
id	task	access object	operator info
Sort	root		index_merge.t1.c1
└─HashJoin	root		CARTESIAN inner join, other cond:or(lt(index_merge.t1.c1, 10), and(lt(index_merge.t1.c2, 10), or(and(gt(index_merge.t1.c3, Column), if(ne(Column, 0), NULL, 1)), or(eq(Column, 0), if(isnull(index_merge.t1.c3), NULL, 0)))))
  ├─StreamAgg(Build)	root		funcs:max(Column)->Column, funcs:sum(0)->Column, funcs:count(1)->Column
  │ └─StreamAgg	root		funcs:count(Column)->Column
  │   └─IndexReader	root		index:StreamAgg
  │     └─StreamAgg	cop[tikv]		funcs:count(1)->Column
  │       └─IndexFullScan	cop[tikv]	table:t2, index:c1(c1)	keep order:false, stats:pseudo
  └─IndexMerge(Probe)	root		type: union
    ├─IndexRangeScan(Build)	cop[tikv]	table:t1, index:c1(c1)	range:[-inf,10), keep order:false, stats:pseudo
    ├─IndexRangeScan(Build)	cop[tikv]	table:t1, index:c2(c2)	range:[-inf,10), keep order:false, stats:pseudo
    └─TableRowIDScan(Probe)	cop[tikv]	table:t1	keep order:false, stats:pseudo
select /*+ use_index_merge(t1) */ * from t1 where c1 < 10 or c2 < 10 and c3 > ALL(select count(1) from t2) order by 1;
c1	c2	c3
1	1	1
2	2	2
3	3	3
4	4	4
5	5	5
// SELECT FIELD
explain format = 'plan_tree' select /*+ use_index_merge(t1) */ c1, (select sum(c2) from t2) from t1 where c1 < 10 or c2 < 10 and c3 > ALL(select count(1) from t2) order by 1;
id	task	access object	operator info
Sort	root		index_merge.t1.c1
└─Projection	root		index_merge.t1.c1, ScalarQueryCol#25(15)->Column
  └─HashJoin	root		CARTESIAN inner join, other cond:or(lt(index_merge.t1.c1, 10), and(lt(index_merge.t1.c2, 10), or(and(gt(index_merge.t1.c3, Column), if(ne(Column, 0), NULL, 1)), or(eq(Column, 0), if(isnull(index_merge.t1.c3), NULL, 0)))))
    ├─StreamAgg(Build)	root		funcs:max(Column)->Column, funcs:sum(0)->Column, funcs:count(1)->Column
    │ └─StreamAgg	root		funcs:count(Column)->Column
    │   └─IndexReader	root		index:StreamAgg
    │     └─StreamAgg	cop[tikv]		funcs:count(1)->Column
    │       └─IndexFullScan	cop[tikv]	table:t2, index:c1(c1)	keep order:false, stats:pseudo
    └─IndexMerge(Probe)	root		type: union
      ├─IndexRangeScan(Build)	cop[tikv]	table:t1, index:c1(c1)	range:[-inf,10), keep order:false, stats:pseudo
      ├─IndexRangeScan(Build)	cop[tikv]	table:t1, index:c2(c2)	range:[-inf,10), keep order:false, stats:pseudo
      └─TableRowIDScan(Probe)	cop[tikv]	table:t1	keep order:false, stats:pseudo
ScalarSubQuery	root		Output: ScalarQueryCol#25
└─MaxOneRow	root		
  └─StreamAgg	root		funcs:sum(Column)->Column
    └─IndexReader	root		index:StreamAgg
      └─StreamAgg	cop[tikv]		funcs:sum(index_merge.t2.c2)->Column
        └─IndexFullScan	cop[tikv]	table:t2, index:c2(c2)	keep order:false, stats:pseudo
select /*+ use_index_merge(t1) */ c1, (select sum(c2) from t2) from t1 where c1 < 10 or c2 < 10 and c3 > ALL(select count(1) from t2) order by 1;
c1	(select sum(c2) from t2)
1	15
2	15
3	15
4	15
5	15
// MULTIPLE LEVEL
explain format = 'plan_tree' select /*+ use_index_merge(t1) */ * from t1 where c1 < 10 or c2 < 10 and c3 IN (select c1 from t2 where c2 in (select c3 from t2)) order by 1;
id	task	access object	operator info
Sort	root		index_merge.t1.c1
└─Projection	root		index_merge.t1.c1, index_merge.t1.c2, index_merge.t1.c3
  └─Selection	root		or(lt(index_merge.t1.c1, 10), and(lt(index_merge.t1.c2, 10), Column))
    └─HashJoin	root		CARTESIAN left outer semi join, left side:IndexMerge, other cond:eq(index_merge.t1.c3, index_merge.t2.c1)
      ├─HashJoin(Build)	root		inner join, equal:[eq(index_merge.t2.c2, index_merge.t2.c3)]
      │ ├─HashAgg(Build)	root		group by:index_merge.t2.c3, funcs:firstrow(index_merge.t2.c3)->index_merge.t2.c3
      │ │ └─TableReader	root		data:Selection
      │ │   └─Selection	cop[tikv]		not(isnull(index_merge.t2.c3))
      │ │     └─TableFullScan	cop[tikv]	table:t2	keep order:false, stats:pseudo
      │ └─TableReader(Probe)	root		data:Selection
      │   └─Selection	cop[tikv]		not(isnull(index_merge.t2.c2))
      │     └─TableFullScan	cop[tikv]	table:t2	keep order:false, stats:pseudo
      └─IndexMerge(Probe)	root		type: union
        ├─IndexRangeScan(Build)	cop[tikv]	table:t1, index:c1(c1)	range:[-inf,10), keep order:false, stats:pseudo
        ├─IndexRangeScan(Build)	cop[tikv]	table:t1, index:c2(c2)	range:[-inf,10), keep order:false, stats:pseudo
        └─TableRowIDScan(Probe)	cop[tikv]	table:t1	keep order:false, stats:pseudo
select /*+ use_index_merge(t1) */ * from t1 where c1 < 10 or c2 < 10 and c3 IN (select c1 from t2 where c2 in (select c3 from t2)) order by 1;
c1	c2	c3
1	1	1
2	2	2
3	3	3
4	4	4
5	5	5
///// Generated Column
drop table if exists t1;
create table t1(c1 int, c2 int, c3 int as (c1 + c2), key(c1), key(c2));
insert into t1(c1, c2) values(1, 1), (2, 2), (3, 3), (4, 4), (5, 5);
explain format = 'plan_tree' select /*+ use_index_merge(t1) */ * from t1 where c1 < 10 or c2 < 10 and c3 < 10 order by 1;
id	task	access object	operator info
Sort	root		index_merge.t1.c1
└─Selection	root		or(lt(index_merge.t1.c1, 10), and(lt(index_merge.t1.c2, 10), lt(index_merge.t1.c3, 10)))
  └─IndexMerge	root		type: union
    ├─IndexRangeScan(Build)	cop[tikv]	table:t1, index:c1(c1)	range:[-inf,10), keep order:false, stats:pseudo
    ├─IndexRangeScan(Build)	cop[tikv]	table:t1, index:c2(c2)	range:[-inf,10), keep order:false, stats:pseudo
    └─TableRowIDScan(Probe)	cop[tikv]	table:t1	keep order:false, stats:pseudo
select /*+ use_index_merge(t1) */ * from t1 where c1 < 10 or c2 < 10 and c3 < 10 order by 1;
c1	c2	c3
1	1	2
2	2	4
3	3	6
4	4	8
5	5	10
explain format = 'plan_tree' select /*+ use_index_merge(t1) */ * from t1 where c1 < 10 or c2 < 10 and c3 = c1 + c2 order by 1;
id	task	access object	operator info
Sort	root		index_merge.t1.c1
└─Selection	root		or(lt(index_merge.t1.c1, 10), and(lt(index_merge.t1.c2, 10), eq(index_merge.t1.c3, plus(index_merge.t1.c1, index_merge.t1.c2))))
  └─IndexMerge	root		type: union
    ├─IndexRangeScan(Build)	cop[tikv]	table:t1, index:c1(c1)	range:[-inf,10), keep order:false, stats:pseudo
    ├─IndexRangeScan(Build)	cop[tikv]	table:t1, index:c2(c2)	range:[-inf,10), keep order:false, stats:pseudo
    └─TableRowIDScan(Probe)	cop[tikv]	table:t1	keep order:false, stats:pseudo
select /*+ use_index_merge(t1) */ * from t1 where c1 < 10 or c2 < 10 and c3 = c1 + c2 order by 1;
c1	c2	c3
1	1	2
2	2	4
3	3	6
4	4	8
5	5	10
explain format = 'plan_tree' select /*+ use_index_merge(t1) */ * from t1 where c1 < 10 or c2 < 10 and substring(c3, c2) order by 1;
id	task	access object	operator info
Sort	root		index_merge.t1.c1
└─Selection	root		or(lt(index_merge.t1.c1, 10), and(lt(index_merge.t1.c2, 10), istrue_with_null(cast(substring(cast(index_merge.t1.c3, var_string(20)), index_merge.t1.c2), double BINARY))))
  └─IndexMerge	root		type: union
    ├─IndexRangeScan(Build)	cop[tikv]	table:t1, index:c1(c1)	range:[-inf,10), keep order:false, stats:pseudo
    ├─IndexRangeScan(Build)	cop[tikv]	table:t1, index:c2(c2)	range:[-inf,10), keep order:false, stats:pseudo
    └─TableRowIDScan(Probe)	cop[tikv]	table:t1	keep order:false, stats:pseudo
select /*+ use_index_merge(t1) */ * from t1 where c1 < 10 or c2 < 10 and substring(c3, c2) order by 1;
c1	c2	c3
1	1	2
2	2	4
3	3	6
4	4	8
5	5	10
explain format = 'plan_tree' select /*+ use_index_merge(t1) */ * from t1 where c1 < 10 or c2 < 10 and c3 order by 1;
id	task	access object	operator info
Sort	root		index_merge.t1.c1
└─Selection	root		or(lt(index_merge.t1.c1, 10), and(lt(index_merge.t1.c2, 10), index_merge.t1.c3))
  └─IndexMerge	root		type: union
    ├─IndexRangeScan(Build)	cop[tikv]	table:t1, index:c1(c1)	range:[-inf,10), keep order:false, stats:pseudo
    ├─IndexRangeScan(Build)	cop[tikv]	table:t1, index:c2(c2)	range:[-inf,10), keep order:false, stats:pseudo
    └─TableRowIDScan(Probe)	cop[tikv]	table:t1	keep order:false, stats:pseudo
select /*+ use_index_merge(t1) */ * from t1 where c1 < 10 or c2 < 10 and c3 order by 1;
c1	c2	c3
1	1	2
2	2	4
3	3	6
4	4	8
5	5	10
///// SQL Binding
create global binding for
select * from t1 where c1 < 10 or c2 < 10 and c3 < 10 order by 1
using
select /*+ use_index_merge(t1) */ * from t1 where c1 < 10 or c2 < 10 and c3 < 10 order by 1;
explain format = 'plan_tree' select * from t1 where c1 < 10 or c2 < 10 and c3 < 10 order by 1;
id	task	access object	operator info
Sort	root		index_merge.t1.c1
└─Selection	root		or(lt(index_merge.t1.c1, 10), and(lt(index_merge.t1.c2, 10), lt(index_merge.t1.c3, 10)))
  └─IndexMerge	root		type: union
    ├─IndexRangeScan(Build)	cop[tikv]	table:t1, index:c1(c1)	range:[-inf,10), keep order:false, stats:pseudo
    ├─IndexRangeScan(Build)	cop[tikv]	table:t1, index:c2(c2)	range:[-inf,10), keep order:false, stats:pseudo
    └─TableRowIDScan(Probe)	cop[tikv]	table:t1	keep order:false, stats:pseudo
select * from t1 where c1 < 10 or c2 < 10 and c3 < 10 order by 1;
c1	c2	c3
1	1	2
2	2	4
3	3	6
4	4	8
5	5	10
drop global binding for select * from t1 where c1 < 10 or c2 < 10 and c3 < 10 order by 1;
///// CREATE TABLE/VIEW
drop table if exists t1;
create table t1(c1 int, c2 int, c3 int, key(c1), key(c2));
insert into t1 values(1, 1, 1), (2, 2, 2), (3, 3, 3), (4, 4, 4), (5, 5, 5);
drop view if exists v2;
create view v2 as select /*+ use_index_merge(t1) */ * from t1 where c1 < 10 or c2 < 10 and c3 < 10;
show create view v2;
View	Create View	character_set_client	collation_connection
v2	CREATE ALGORITHM=UNDEFINED DEFINER=`root`@`%` SQL SECURITY DEFINER VIEW `v2` (`c1`, `c2`, `c3`) AS SELECT /*+ USE_INDEX_MERGE(`t1` )*/ `index_merge`.`t1`.`c1` AS `c1`,`index_merge`.`t1`.`c2` AS `c2`,`index_merge`.`t1`.`c3` AS `c3` FROM `index_merge`.`t1` WHERE `c1`<10 OR `c2`<10 AND `c3`<10	utf8mb4	utf8mb4_general_ci
select * from v2 order by 1;
c1	c2	c3
1	1	1
2	2	2
3	3	3
4	4	4
5	5	5
///// DROP/ALTER INDEX
drop table if exists t1;
create table t1(c1 int, c2 int, c3 int, key(c1), key(c2));
insert into t1 values(1, 1, 1), (2, 2, 2), (3, 3, 3), (4, 4, 4), (5, 5, 5);
explain format = 'plan_tree' select /*+ use_index_merge(t1) */ * from t1 where c1 < 10 or c2 < 10 and c3 < 10 order by 1;
id	task	access object	operator info
Sort	root		index_merge.t1.c1
└─IndexMerge	root		type: union
  ├─IndexRangeScan(Build)	cop[tikv]	table:t1, index:c1(c1)	range:[-inf,10), keep order:false, stats:pseudo
  ├─IndexRangeScan(Build)	cop[tikv]	table:t1, index:c2(c2)	range:[-inf,10), keep order:false, stats:pseudo
  └─Selection(Probe)	cop[tikv]		or(lt(index_merge.t1.c1, 10), and(lt(index_merge.t1.c2, 10), lt(index_merge.t1.c3, 10)))
    └─TableRowIDScan	cop[tikv]	table:t1	keep order:false, stats:pseudo
select /*+ use_index_merge(t1) */ * from t1 where c1 < 10 or c2 < 10 and c3 < 10 order by 1;
c1	c2	c3
1	1	1
2	2	2
3	3	3
4	4	4
5	5	5
drop index c1 on t1;
explain format = 'plan_tree' select /*+ use_index_merge(t1) */ * from t1 where c1 < 10 or c2 < 10 and c3 < 10 order by 1;
id	task	access object	operator info
Sort	root		index_merge.t1.c1
└─TableReader	root		data:Selection
  └─Selection	cop[tikv]		or(lt(index_merge.t1.c1, 10), and(lt(index_merge.t1.c2, 10), lt(index_merge.t1.c3, 10)))
    └─TableFullScan	cop[tikv]	table:t1	keep order:false, stats:pseudo
select /*+ use_index_merge(t1) */ * from t1 where c1 < 10 or c2 < 10 and c3 < 10 order by 1;
c1	c2	c3
1	1	1
2	2	2
3	3	3
4	4	4
5	5	5
alter table t1 add index c1(c1);
explain format = 'plan_tree' select /*+ use_index_merge(t1) */ * from t1 where c1 < 10 or c2 < 10 and c3 < 10 order by 1;
id	task	access object	operator info
Sort	root		index_merge.t1.c1
└─IndexMerge	root		type: union
  ├─IndexRangeScan(Build)	cop[tikv]	table:t1, index:c1(c1)	range:[-inf,10), keep order:false, stats:pseudo
  ├─IndexRangeScan(Build)	cop[tikv]	table:t1, index:c2(c2)	range:[-inf,10), keep order:false, stats:pseudo
  └─Selection(Probe)	cop[tikv]		or(lt(index_merge.t1.c1, 10), and(lt(index_merge.t1.c2, 10), lt(index_merge.t1.c3, 10)))
    └─TableRowIDScan	cop[tikv]	table:t1	keep order:false, stats:pseudo
select /*+ use_index_merge(t1) */ * from t1 where c1 < 10 or c2 < 10 and c3 < 10 order by 1;
c1	c2	c3
1	1	1
2	2	2
3	3	3
4	4	4
5	5	5
///// DELETE
drop table if exists t1;
create table t1(c1 int, c2 int, c3 int, key(c1), key(c2));
insert into t1 values(1, 1, 1), (2, 2, 2), (3, 3, 3), (4, 4, 4), (5, 5, 5);
explain format = 'plan_tree' delete from t1 where c1 in (select /*+ use_index_merge(t1) */ c1 from t1 where c1 < 10 or c2 < 10 and c3 < 10) order by 1;
id	task	access object	operator info
Delete	root		N/A
└─Sort	root		index_merge.t1.c1
  └─HashJoin	root		inner join, equal:[eq(index_merge.t1.c1, index_merge.t1.c1)]
    ├─HashAgg(Build)	root		group by:index_merge.t1.c1, funcs:firstrow(index_merge.t1.c1)->index_merge.t1.c1
    │ └─IndexMerge	root		type: union
    │   ├─IndexRangeScan(Build)	cop[tikv]	table:t1, index:c1(c1)	range:[-inf,10), keep order:false, stats:pseudo
    │   ├─IndexRangeScan(Build)	cop[tikv]	table:t1, index:c2(c2)	range:[-inf,10), keep order:false, stats:pseudo
    │   └─Selection(Probe)	cop[tikv]		not(isnull(index_merge.t1.c1)), or(lt(index_merge.t1.c1, 10), and(lt(index_merge.t1.c2, 10), lt(index_merge.t1.c3, 10)))
    │     └─TableRowIDScan	cop[tikv]	table:t1	keep order:false, stats:pseudo
    └─TableReader(Probe)	root		data:Selection
      └─Selection	cop[tikv]		not(isnull(index_merge.t1.c1))
        └─TableFullScan	cop[tikv]	table:t1	keep order:false, stats:pseudo
delete from t1 where c1 in (select /*+ use_index_merge(t1) */ c1 from t1 where c1 < 10 or c2 < 10 and c3 < 10) order by 1;
select * from t1;
c1	c2	c3
///// UPDATE
explain format = 'plan_tree' update t1 set c1 = 100, c2 = 100, c3 = 100 where c1 in (select /*+ use_index_merge(t1) */ c1 from t1 where c1 < 10 or c2 < 10 and c3 < 10);
id	task	access object	operator info
Update	root		N/A
└─HashJoin	root		inner join, equal:[eq(index_merge.t1.c1, index_merge.t1.c1)]
  ├─HashAgg(Build)	root		group by:index_merge.t1.c1, funcs:firstrow(index_merge.t1.c1)->index_merge.t1.c1
  │ └─IndexMerge	root		type: union
  │   ├─IndexRangeScan(Build)	cop[tikv]	table:t1, index:c1(c1)	range:[-inf,10), keep order:false, stats:pseudo
  │   ├─IndexRangeScan(Build)	cop[tikv]	table:t1, index:c2(c2)	range:[-inf,10), keep order:false, stats:pseudo
  │   └─Selection(Probe)	cop[tikv]		not(isnull(index_merge.t1.c1)), or(lt(index_merge.t1.c1, 10), and(lt(index_merge.t1.c2, 10), lt(index_merge.t1.c3, 10)))
  │     └─TableRowIDScan	cop[tikv]	table:t1	keep order:false, stats:pseudo
  └─TableReader(Probe)	root		data:Selection
    └─Selection	cop[tikv]		not(isnull(index_merge.t1.c1))
      └─TableFullScan	cop[tikv]	table:t1	keep order:false, stats:pseudo
update t1 set c1 = 100, c2 = 100, c3 = 100 where c1 in (select /*+ use_index_merge(t1) */ c1 from t1 where c1 < 10 or c2 < 10 and c3 < 10);
select * from t1;
c1	c2	c3
///// FOR UPDATE
explain format = 'plan_tree' select /*+ use_index_merge(t1) */ * from t1 where c1 < 10 or c2 < 10 and c3 < 10 order by 1 for update;
id	task	access object	operator info
Sort	root		index_merge.t1.c1
└─Projection	root		index_merge.t1.c1, index_merge.t1.c2, index_merge.t1.c3
  └─SelectLock	root		for update 0
    └─IndexMerge	root		type: union
      ├─IndexRangeScan(Build)	cop[tikv]	table:t1, index:c1(c1)	range:[-inf,10), keep order:false, stats:pseudo
      ├─IndexRangeScan(Build)	cop[tikv]	table:t1, index:c2(c2)	range:[-inf,10), keep order:false, stats:pseudo
      └─Selection(Probe)	cop[tikv]		or(lt(index_merge.t1.c1, 10), and(lt(index_merge.t1.c2, 10), lt(index_merge.t1.c3, 10)))
        └─TableRowIDScan	cop[tikv]	table:t1	keep order:false, stats:pseudo
select /*+ use_index_merge(t1) */ * from t1 where c1 < 10 or c2 < 10 and c3 < 10 order by 1 for update;
c1	c2	c3
///// TEMPORARY Table. Not support for now.
drop table if exists t1;
create temporary table t1(c1 int, c2 int, c3 int, key(c1), key(c2));
insert into t1 values(1, 1, 1), (2, 2, 2), (3, 3, 3), (4, 4, 4), (5, 5, 5);
explain format = 'plan_tree' select /*+ use_index_merge(t1) */ * from t1 where c1 < 10 or c2 < 10 and c3 < 10 order by 1;
id	task	access object	operator info
Projection	root		index_merge.t1.c1, index_merge.t1.c2, index_merge.t1.c3
└─UnionScan	root		or(lt(index_merge.t1.c1, 10), and(lt(index_merge.t1.c2, 10), lt(index_merge.t1.c3, 10)))
  └─IndexLookUp	root		
    ├─IndexFullScan(Build)	cop[tikv]	table:t1, index:c1(c1)	keep order:true, stats:pseudo
    └─Selection(Probe)	cop[tikv]		or(lt(index_merge.t1.c1, 10), and(lt(index_merge.t1.c2, 10), lt(index_merge.t1.c3, 10)))
      └─TableRowIDScan	cop[tikv]	table:t1	keep order:false, stats:pseudo
select /*+ use_index_merge(t1) */ * from t1 where c1 < 10 or c2 < 10 and c3 < 10 order by 1;
c1	c2	c3
1	1	1
2	2	2
3	3	3
4	4	4
5	5	5
///// MEMORY Table
explain format = 'plan_tree' select count(c1) from (select /*+ use_index_merge(t_alias), stream_agg() */ count(1) c1 from information_schema.statements_summary where sum_latency >= 0 or max_latency >= 0 order by 1) dt;
id	task	access object	operator info
StreamAgg	root		funcs:count(Column)->Column
└─StreamAgg	root		funcs:count(1)->Column
  └─MemTableScan	root	table:STATEMENTS_SUMMARY	
show warnings;
Level	Code	Message
Warning	1815	use_index_merge(index_merge.t_alias) is inapplicable, check whether the table(index_merge.t_alias) exists
select count(c1) from (select /*+ use_index_merge(t_alias), stream_agg() */ count(1) c1 from information_schema.statements_summary where sum_latency >= 0 or max_latency >= 0 order by 1) dt;
count(c1)
1
///// Limit
drop table if exists t1;
create table t1(c1 int, c2 int, c3 int, key(c1), key(c2));
insert into t1 values(1, 1, 1), (2, 2, 2), (3, 3, 3), (4, 4, 4), (5, 5, 5);
explain format = 'plan_tree' select /*+ use_index_merge(t1) */ * from t1 where (c1 < 10 or c2 < 10) and c3 < 10 order by 1 limit 1 offset 2;
id	task	access object	operator info
TopN	root		index_merge.t1.c1, offset:2, count:1
└─IndexMerge	root		type: union
  ├─IndexRangeScan(Build)	cop[tikv]	table:t1, index:c1(c1)	range:[-inf,10), keep order:false, stats:pseudo
  ├─IndexRangeScan(Build)	cop[tikv]	table:t1, index:c2(c2)	range:[-inf,10), keep order:false, stats:pseudo
  └─TopN(Probe)	cop[tikv]		index_merge.t1.c1, offset:0, count:3
    └─Selection	cop[tikv]		lt(index_merge.t1.c3, 10)
      └─TableRowIDScan	cop[tikv]	table:t1	keep order:false, stats:pseudo
select /*+ use_index_merge(t1) */ * from t1 where (c1 < 10 or c2 < 10) and c3 < 10 order by 1 limit 1 offset 2;
c1	c2	c3
3	3	3
///// GROUP BY
explain format = 'plan_tree' select /*+ use_index_merge(t1) */ sum(c1) from t1 where (c1 < 10 or c2 < 10) and c3 < 10 group by c1 order by 1;
id	task	access object	operator info
Sort	root		Column
└─HashAgg	root		group by:Column, funcs:sum(Column)->Column
  └─Projection	root		cast(index_merge.t1.c1, decimal(10,0) BINARY)->Column, index_merge.t1.c1->Column
    └─IndexMerge	root		type: union
      ├─IndexRangeScan(Build)	cop[tikv]	table:t1, index:c1(c1)	range:[-inf,10), keep order:false, stats:pseudo
      ├─IndexRangeScan(Build)	cop[tikv]	table:t1, index:c2(c2)	range:[-inf,10), keep order:false, stats:pseudo
      └─Selection(Probe)	cop[tikv]		lt(index_merge.t1.c3, 10)
        └─TableRowIDScan	cop[tikv]	table:t1	keep order:false, stats:pseudo
select /*+ use_index_merge(t1) */ sum(c1) from t1 where (c1 < 10 or c2 < 10) and c3 < 10 group by c1 order by 1;
sum(c1)
1
2
3
4
5
///// Apply
drop table if exists t2;
create table t2(c1 int, c2 int, c3 int, key(c1), key(c2));
insert into t2 values(1, 1, 1), (2, 2, 2), (3, 3, 3), (4, 4, 4), (5, 5, 5);
explain format = 'plan_tree' select /*+ use_index_merge(t1) */ * from t1 where t1.c1 = (select avg(t2.c1) from t2 where t1.c1 = t2.c1 group by t2.c1) and (c1 < 10 or c2 < -1) and c3 < 10 order by 1;
id	task	access object	operator info
Sort	root		index_merge.t1.c1
└─Projection	root		index_merge.t1.c1, index_merge.t1.c2, index_merge.t1.c3
  └─Apply	root		inner join, equal:[eq(Column, Column)]
    ├─Projection(Build)	root		index_merge.t1.c1, index_merge.t1.c2, index_merge.t1.c3, cast(index_merge.t1.c1, decimal(10,0) BINARY)->Column
    │ └─IndexMerge	root		type: union
    │   ├─IndexRangeScan(Build)	cop[tikv]	table:t1, index:c1(c1)	range:[-inf,10), keep order:false, stats:pseudo
    │   ├─IndexRangeScan(Build)	cop[tikv]	table:t1, index:c2(c2)	range:[-inf,-1), keep order:false, stats:pseudo
    │   └─Selection(Probe)	cop[tikv]		lt(index_merge.t1.c3, 10)
    │     └─TableRowIDScan	cop[tikv]	table:t1	keep order:false, stats:pseudo
    └─MaxOneRow(Probe)	root		
      └─StreamAgg	root		group by:index_merge.t2.c1, funcs:avg(Column, Column)->Column
        └─IndexReader	root		index:StreamAgg
          └─StreamAgg	cop[tikv]		group by:index_merge.t2.c1, funcs:count(index_merge.t2.c1)->Column, funcs:sum(index_merge.t2.c1)->Column
            └─IndexRangeScan	cop[tikv]	table:t2, index:c1(c1)	range: decided by [eq(index_merge.t1.c1, index_merge.t2.c1)], keep order:true, stats:pseudo
select /*+ use_index_merge(t1) */ * from t1 where t1.c1 = (select avg(t2.c1) from t2 where t1.c1 = t2.c1 group by t2.c1) and (c1 < 10 or c2 < -1) and c3 < 10 order by 1;
c1	c2	c3
1	1	1
2	2	2
3	3	3
4	4	4
5	5	5
explain format = 'plan_tree' select /*+ use_index_merge(t1) */ * from t1 where t1.c1 = (select /*+ use_index_merge(t2) */ avg(t2.c1) from t2 where t1.c1 = t2.c1 and t2.c1 < 10 or t2.c2 < 10 group by t2.c1 order by c1 limit 1 offset 2) and (c1 < 10 or c2 < -1) and c3 < 10 order by 1;
id	task	access object	operator info
Sort	root		index_merge.t1.c1
└─Projection	root		index_merge.t1.c1, index_merge.t1.c2, index_merge.t1.c3
  └─Apply	root		inner join, equal:[eq(Column, Column)]
    ├─Projection(Build)	root		index_merge.t1.c1, index_merge.t1.c2, index_merge.t1.c3, cast(index_merge.t1.c1, decimal(10,0) BINARY)->Column
    │ └─IndexMerge	root		type: union
    │   ├─IndexRangeScan(Build)	cop[tikv]	table:t1, index:c1(c1)	range:[-inf,10), keep order:false, stats:pseudo
    │   ├─IndexRangeScan(Build)	cop[tikv]	table:t1, index:c2(c2)	range:[-inf,-1), keep order:false, stats:pseudo
    │   └─Selection(Probe)	cop[tikv]		lt(index_merge.t1.c3, 10)
    │     └─TableRowIDScan	cop[tikv]	table:t1	keep order:false, stats:pseudo
    └─TopN(Probe)	root		index_merge.t2.c1, offset:2, count:1
      └─HashAgg	root		group by:Column, funcs:avg(Column)->Column, funcs:firstrow(Column)->index_merge.t2.c1
        └─Projection	root		cast(index_merge.t2.c1, decimal(10,0) BINARY)->Column, index_merge.t2.c1->Column
          └─IndexMerge	root		type: union
            ├─Selection(Build)	cop[tikv]		eq(index_merge.t1.c1, index_merge.t2.c1)
            │ └─IndexRangeScan	cop[tikv]	table:t2, index:c1(c1)	range:[-inf,10), keep order:false, stats:pseudo
            ├─IndexRangeScan(Build)	cop[tikv]	table:t2, index:c2(c2)	range:[-inf,10), keep order:false, stats:pseudo
            └─TableRowIDScan(Probe)	cop[tikv]	table:t2	keep order:false, stats:pseudo
select /*+ use_index_merge(t1) */ * from t1 where t1.c1 = (select /*+ use_index_merge(t2) */ avg(t2.c1) from t2 where t1.c1 = t2.c1 and t2.c1 < 10 or t2.c2 < 10 group by t2.c1 order by c1 limit 1 offset 2) and (c1 < 10 or c2 < -1) and c3 < 10 order by 1;
c1	c2	c3
3	3	3
///// Nested filters
drop table if exists t1;
create table t1(c1 int, c2 int, c3 int, c4 int, c5 int, key(c1), key(c2), key(c3), key(c4));
insert into t1 values(1, 1, 1, 1, 1), (2, 2, 2, 2, 2), (3, 3, 3, 3, 3), (4, 4, 4, 4, 4), (5, 5, 5, 5, 5);
explain format = 'plan_tree' select /*+ use_index_merge(t1) */ * from t1 where (c1 < 10 or c2 < 10) and (c3 < 10 or c4 < 10) order by 1;
id	task	access object	operator info
Sort	root		index_merge.t1.c1
└─IndexMerge	root		type: union
  ├─IndexRangeScan(Build)	cop[tikv]	table:t1, index:c1(c1)	range:[-inf,10), keep order:false, stats:pseudo
  ├─IndexRangeScan(Build)	cop[tikv]	table:t1, index:c2(c2)	range:[-inf,10), keep order:false, stats:pseudo
  └─Selection(Probe)	cop[tikv]		or(lt(index_merge.t1.c3, 10), lt(index_merge.t1.c4, 10))
    └─TableRowIDScan	cop[tikv]	table:t1	keep order:false, stats:pseudo
select /*+ use_index_merge(t1) */ * from t1 where (c1 < 10 or c2 < 10) and (c3 < 10 or c4 < 10) order by 1;
c1	c2	c3	c4	c5
1	1	1	1	1
2	2	2	2	2
3	3	3	3	3
4	4	4	4	4
5	5	5	5	5
explain format = 'plan_tree' select /*+ use_index_merge(t1) */ * from t1 where (c1 < 10 and c2 < 10) or (c3 < 10 and c4 < 10) order by 1;
id	task	access object	operator info
Sort	root		index_merge.t1.c1
└─IndexMerge	root		type: union
  ├─IndexRangeScan(Build)	cop[tikv]	table:t1, index:c1(c1)	range:[-inf,10), keep order:false, stats:pseudo
  ├─IndexRangeScan(Build)	cop[tikv]	table:t1, index:c3(c3)	range:[-inf,10), keep order:false, stats:pseudo
  └─Selection(Probe)	cop[tikv]		or(and(lt(index_merge.t1.c1, 10), lt(index_merge.t1.c2, 10)), and(lt(index_merge.t1.c3, 10), lt(index_merge.t1.c4, 10)))
    └─TableRowIDScan	cop[tikv]	table:t1	keep order:false, stats:pseudo
select /*+ use_index_merge(t1) */ * from t1 where (c1 < 10 and c2 < 10) or (c3 < 10 and c4 < 10) order by 1;
c1	c2	c3	c4	c5
1	1	1	1	1
2	2	2	2	2
3	3	3	3	3
4	4	4	4	4
5	5	5	5	5
explain format = 'plan_tree' select /*+ use_index_merge(t1) */ * from t1 where (c1 < 10 and c2 < 10) or (c3 < 10 and c4 < 10) and c5 < 10 order by 1;
id	task	access object	operator info
Sort	root		index_merge.t1.c1
└─IndexMerge	root		type: union
  ├─IndexRangeScan(Build)	cop[tikv]	table:t1, index:c1(c1)	range:[-inf,10), keep order:false, stats:pseudo
  ├─IndexRangeScan(Build)	cop[tikv]	table:t1, index:c3(c3)	range:[-inf,10), keep order:false, stats:pseudo
  └─Selection(Probe)	cop[tikv]		or(and(lt(index_merge.t1.c1, 10), lt(index_merge.t1.c2, 10)), and(lt(index_merge.t1.c3, 10), and(lt(index_merge.t1.c4, 10), lt(index_merge.t1.c5, 10))))
    └─TableRowIDScan	cop[tikv]	table:t1	keep order:false, stats:pseudo
select /*+ use_index_merge(t1) */ * from t1 where (c1 < 10 and c2 < 10) or (c3 < 10 and c4 < 10) and c4 < 10 order by 1;
c1	c2	c3	c4	c5
1	1	1	1	1
2	2	2	2	2
3	3	3	3	3
4	4	4	4	4
5	5	5	5	5
explain format = 'plan_tree' select /*+ use_index_merge(t1) */ * from t1 where ((c1 < 10 and c4 < 10) or c2 < 10) and (c3 < 10 or c5 < 10) order by 1;
id	task	access object	operator info
Sort	root		index_merge.t1.c1
└─IndexMerge	root		type: union
  ├─IndexRangeScan(Build)	cop[tikv]	table:t1, index:c1(c1)	range:[-inf,10), keep order:false, stats:pseudo
  ├─IndexRangeScan(Build)	cop[tikv]	table:t1, index:c2(c2)	range:[-inf,10), keep order:false, stats:pseudo
  └─Selection(Probe)	cop[tikv]		or(and(lt(index_merge.t1.c1, 10), lt(index_merge.t1.c4, 10)), lt(index_merge.t1.c2, 10)), or(lt(index_merge.t1.c3, 10), lt(index_merge.t1.c5, 10))
    └─TableRowIDScan	cop[tikv]	table:t1	keep order:false, stats:pseudo
select /*+ use_index_merge(t1) */ * from t1 where ((c1 < 10 and c4 < 10) or c2 < 10) and (c3 < 10 or c4 < 10) order by 1;
c1	c2	c3	c4	c5
1	1	1	1	1
2	2	2	2	2
3	3	3	3	3
4	4	4	4	4
5	5	5	5	5
explain format = 'plan_tree' select /*+ use_index_merge(t1) */ * from t1 where (((c1 < 10 or c3 < 10) and (c1 < 10 or c4 < 10)) or c2 < 10) and (c3 < 10 or c5 < 10) order by 1;
id	task	access object	operator info
Sort	root		index_merge.t1.c1
└─TableReader	root		data:Selection
  └─Selection	cop[tikv]		or(and(or(lt(index_merge.t1.c1, 10), lt(index_merge.t1.c3, 10)), or(lt(index_merge.t1.c1, 10), lt(index_merge.t1.c4, 10))), lt(index_merge.t1.c2, 10)), or(lt(index_merge.t1.c3, 10), lt(index_merge.t1.c5, 10))
    └─TableFullScan	cop[tikv]	table:t1	keep order:false, stats:pseudo
show warnings;
Level	Code	Message
Warning	1105	IndexMerge is inapplicable
select /*+ use_index_merge(t1) */ * from t1 where (((c1 < 10 or c3 < 10) and (c1 < 10 or c4 < 10)) or c2 < 10) and (c3 < 10 or c5 < 10) order by 1;
c1	c2	c3	c4	c5
1	1	1	1	1
2	2	2	2	2
3	3	3	3	3
4	4	4	4	4
5	5	5	5	5
explain format = 'plan_tree' select /*+ use_index_merge(t1) */ * from t1 where (((c1 < 10 or c3 < 10) and c1 < 10) or c2 < 10) and (c3 < 10 or c5 < 10) order by 1;
id	task	access object	operator info
Sort	root		index_merge.t1.c1
└─IndexMerge	root		type: union
  ├─IndexRangeScan(Build)	cop[tikv]	table:t1, index:c1(c1)	range:[-inf,10), keep order:false, stats:pseudo
  ├─IndexRangeScan(Build)	cop[tikv]	table:t1, index:c2(c2)	range:[-inf,10), keep order:false, stats:pseudo
  └─Selection(Probe)	cop[tikv]		or(and(or(lt(index_merge.t1.c1, 10), lt(index_merge.t1.c3, 10)), lt(index_merge.t1.c1, 10)), lt(index_merge.t1.c2, 10)), or(lt(index_merge.t1.c3, 10), lt(index_merge.t1.c5, 10))
    └─TableRowIDScan	cop[tikv]	table:t1	keep order:false, stats:pseudo
select /*+ use_index_merge(t1) */ * from t1 where (((c1 < 10 or c3 < 10) and c1 < 10) or c2 < 10) and (c3 < 10 or c5 < 10) order by 1;
c1	c2	c3	c4	c5
1	1	1	1	1
2	2	2	2	2
3	3	3	3	3
4	4	4	4	4
5	5	5	5	5
///// All kinds of expressions
// common functions
explain format = 'plan_tree' select /*+ use_index_merge(t1) */ * from t1 where (c1 < 10 or c2 < 10) and coalesce(c1, c2, c4) = 1 order by 1;
id	task	access object	operator info
Sort	root		index_merge.t1.c1
└─IndexMerge	root		type: union
  ├─IndexRangeScan(Build)	cop[tikv]	table:t1, index:c1(c1)	range:[-inf,10), keep order:false, stats:pseudo
  ├─IndexRangeScan(Build)	cop[tikv]	table:t1, index:c2(c2)	range:[-inf,10), keep order:false, stats:pseudo
  └─Selection(Probe)	cop[tikv]		eq(coalesce(index_merge.t1.c1, index_merge.t1.c2, index_merge.t1.c4), 1)
    └─TableRowIDScan	cop[tikv]	table:t1	keep order:false, stats:pseudo
select /*+ use_index_merge(t1) */ * from t1 where (c1 < 10 or c2 < 10) and coalesce(c1, c2, c4) = 1 order by 1;
c1	c2	c3	c4	c5
1	1	1	1	1
explain format = 'plan_tree' select /*+ use_index_merge(t1) */ * from t1 where (c1 < 10 or c2 < 10) and greatest(c1, c2, c4) = 1 order by 1;
id	task	access object	operator info
Sort	root		index_merge.t1.c1
└─Selection	root		eq(greatest(index_merge.t1.c1, index_merge.t1.c2, index_merge.t1.c4), 1)
  └─IndexMerge	root		type: union
    ├─IndexRangeScan(Build)	cop[tikv]	table:t1, index:c1(c1)	range:[-inf,10), keep order:false, stats:pseudo
    ├─IndexRangeScan(Build)	cop[tikv]	table:t1, index:c2(c2)	range:[-inf,10), keep order:false, stats:pseudo
    └─TableRowIDScan(Probe)	cop[tikv]	table:t1	keep order:false, stats:pseudo
select /*+ use_index_merge(t1) */ * from t1 where (c1 < 10 or c2 < 10) and greatest(c1, c2, c4) = 1 order by 1;
c1	c2	c3	c4	c5
1	1	1	1	1
// math functions
explain format = 'plan_tree' select /*+ use_index_merge(t1) */ * from t1 where (c1 < 10 or c2 < 10) and abs(c1) = 1 order by 1;
id	task	access object	operator info
Sort	root		index_merge.t1.c1
└─IndexMerge	root		type: union
  ├─IndexRangeScan(Build)	cop[tikv]	table:t1, index:c1(c1)	range:[-inf,10), keep order:false, stats:pseudo
  ├─IndexRangeScan(Build)	cop[tikv]	table:t1, index:c2(c2)	range:[-inf,10), keep order:false, stats:pseudo
  └─Selection(Probe)	cop[tikv]		eq(abs(index_merge.t1.c1), 1)
    └─TableRowIDScan	cop[tikv]	table:t1	keep order:false, stats:pseudo
select /*+ use_index_merge(t1) */ * from t1 where (c1 < 10 or c2 < 10) and abs(c1) = 1 order by 1;
c1	c2	c3	c4	c5
1	1	1	1	1
explain format = 'plan_tree' select /*+ use_index_merge(t1) */ * from t1 where (c1 < 10 or c2 < 10) and pi() order by 1;
id	task	access object	operator info
Sort	root		index_merge.t1.c1
└─IndexMerge	root		type: union
  ├─IndexRangeScan(Build)	cop[tikv]	table:t1, index:c1(c1)	range:[-inf,10), keep order:false, stats:pseudo
  ├─IndexRangeScan(Build)	cop[tikv]	table:t1, index:c2(c2)	range:[-inf,10), keep order:false, stats:pseudo
  └─TableRowIDScan(Probe)	cop[tikv]	table:t1	keep order:false, stats:pseudo
select /*+ use_index_merge(t1) */ * from t1 where (c1 < 10 or c2 < 10) and pi() order by 1;
c1	c2	c3	c4	c5
1	1	1	1	1
2	2	2	2	2
3	3	3	3	3
4	4	4	4	4
5	5	5	5	5
explain format = 'plan_tree' select /*+ use_index_merge(t1) */ * from t1 where (c1 < 10 or c2 < 10) and ceil(c1) order by 1;
id	task	access object	operator info
Sort	root		index_merge.t1.c1
└─IndexMerge	root		type: union
  ├─IndexRangeScan(Build)	cop[tikv]	table:t1, index:c1(c1)	range:[-inf,10), keep order:false, stats:pseudo
  ├─IndexRangeScan(Build)	cop[tikv]	table:t1, index:c2(c2)	range:[-inf,10), keep order:false, stats:pseudo
  └─Selection(Probe)	cop[tikv]		ceil(index_merge.t1.c1)
    └─TableRowIDScan	cop[tikv]	table:t1	keep order:false, stats:pseudo
select /*+ use_index_merge(t1) */ * from t1 where (c1 < 10 or c2 < 10) and ceil(c1) order by 1;
c1	c2	c3	c4	c5
1	1	1	1	1
2	2	2	2	2
3	3	3	3	3
4	4	4	4	4
5	5	5	5	5
explain format = 'plan_tree' select /*+ use_index_merge(t1) */ * from t1 where (c1 < 10 or c2 < 10) and truncate(c1, 1) = 1 order by 1;
id	task	access object	operator info
Sort	root		index_merge.t1.c1
└─Selection	root		eq(truncate(index_merge.t1.c1, 1), 1)
  └─IndexMerge	root		type: union
    ├─IndexRangeScan(Build)	cop[tikv]	table:t1, index:c1(c1)	range:[-inf,10), keep order:false, stats:pseudo
    ├─IndexRangeScan(Build)	cop[tikv]	table:t1, index:c2(c2)	range:[-inf,10), keep order:false, stats:pseudo
    └─TableRowIDScan(Probe)	cop[tikv]	table:t1	keep order:false, stats:pseudo
select /*+ use_index_merge(t1) */ * from t1 where (c1 < 10 or c2 < 10) and truncate(c1, 1) = 1 order by 1;
c1	c2	c3	c4	c5
1	1	1	1	1
explain format = 'plan_tree' select /*+ use_index_merge(t1) */ * from t1 where (c1 < 10 or c2 < 10) and sqrt(-1) order by 1;
id	task	access object	operator info
TableDual	root		rows:0
select /*+ use_index_merge(t1) */ * from t1 where (c1 < 10 or c2 < 10) and sqrt(-1) order by 1;
c1	c2	c3	c4	c5
// string functions
explain format = 'plan_tree' select /*+ use_index_merge(t1) */ * from t1 where (c1 < 10 or c2 < 10) and substring(c3, 1, 1) = '1' order by 1;
id	task	access object	operator info
Sort	root		index_merge.t1.c1
└─IndexMerge	root		type: union
  ├─IndexRangeScan(Build)	cop[tikv]	table:t1, index:c1(c1)	range:[-inf,10), keep order:false, stats:pseudo
  ├─IndexRangeScan(Build)	cop[tikv]	table:t1, index:c2(c2)	range:[-inf,10), keep order:false, stats:pseudo
  └─Selection(Probe)	cop[tikv]		eq(substring(cast(index_merge.t1.c3, var_string(20)), 1, 1), "1")
    └─TableRowIDScan	cop[tikv]	table:t1	keep order:false, stats:pseudo
select /*+ use_index_merge(t1) */ * from t1 where (c1 < 10 or c2 < 10) and substring(c3, 1, 1) = '1' order by 1;
c1	c2	c3	c4	c5
1	1	1	1	1
// control functions
explain format = 'plan_tree' select /*+ use_index_merge(t1) */ * from t1 where (c1 < 10 or c2 < 10) and ifnull(c1, c2) order by 1;
id	task	access object	operator info
Sort	root		index_merge.t1.c1
└─IndexMerge	root		type: union
  ├─IndexRangeScan(Build)	cop[tikv]	table:t1, index:c1(c1)	range:[-inf,10), keep order:false, stats:pseudo
  ├─IndexRangeScan(Build)	cop[tikv]	table:t1, index:c2(c2)	range:[-inf,10), keep order:false, stats:pseudo
  └─Selection(Probe)	cop[tikv]		ifnull(index_merge.t1.c1, index_merge.t1.c2)
    └─TableRowIDScan	cop[tikv]	table:t1	keep order:false, stats:pseudo
select /*+ use_index_merge(t1) */ * from t1 where (c1 < 10 or c2 < 10) and ifnull(c1, c2) order by 1;
c1	c2	c3	c4	c5
1	1	1	1	1
2	2	2	2	2
3	3	3	3	3
4	4	4	4	4
5	5	5	5	5
explain format = 'plan_tree' select /*+ use_index_merge(t1) */ * from t1 where (c1 < 10 or c2 < 10) and if(c1, c2, c3) order by 1;
id	task	access object	operator info
Sort	root		index_merge.t1.c1
└─IndexMerge	root		type: union
  ├─IndexRangeScan(Build)	cop[tikv]	table:t1, index:c1(c1)	range:[-inf,10), keep order:false, stats:pseudo
  ├─IndexRangeScan(Build)	cop[tikv]	table:t1, index:c2(c2)	range:[-inf,10), keep order:false, stats:pseudo
  └─Selection(Probe)	cop[tikv]		if(index_merge.t1.c1, index_merge.t1.c2, index_merge.t1.c3)
    └─TableRowIDScan	cop[tikv]	table:t1	keep order:false, stats:pseudo
select /*+ use_index_merge(t1) */ * from t1 where (c1 < 10 or c2 < 10) and if(c1, c2, c3) order by 1;
c1	c2	c3	c4	c5
1	1	1	1	1
2	2	2	2	2
3	3	3	3	3
4	4	4	4	4
5	5	5	5	5
explain format = 'plan_tree' select /*+ use_index_merge(t1) */ * from t1 where (c1 < 10 or c2 < 10) and (c1 between 1 and 2) order by 1;
id	task	access object	operator info
Sort	root		index_merge.t1.c1
└─IndexMerge	root		type: union
  ├─IndexRangeScan(Build)	cop[tikv]	table:t1, index:c1(c1)	range:[1,2], keep order:false, stats:pseudo
  ├─IndexRangeScan(Build)	cop[tikv]	table:t1, index:c2(c2)	range:[-inf,10), keep order:false, stats:pseudo
  └─Selection(Probe)	cop[tikv]		ge(index_merge.t1.c1, 1), le(index_merge.t1.c1, 2)
    └─TableRowIDScan	cop[tikv]	table:t1	keep order:false, stats:pseudo
select /*+ use_index_merge(t1) */ * from t1 where (c1 < 10 or c2 < 10) and (c1 between 1 and 2) order by 1;
c1	c2	c3	c4	c5
1	1	1	1	1
2	2	2	2	2
// mixed usage
set @a = 1;
explain format = 'plan_tree' select /*+ use_index_merge(t1) */ * from t1 where (c1 < 10 or c2 < 10) and length(substring(sqrt(c3), @a, 1)) = char_length(if(c1, c2, c3)) order by 1;
id	task	access object	operator info
Sort	root		index_merge.t1.c1
└─IndexMerge	root		type: union
  ├─IndexRangeScan(Build)	cop[tikv]	table:t1, index:c1(c1)	range:[-inf,10), keep order:false, stats:pseudo
  ├─IndexRangeScan(Build)	cop[tikv]	table:t1, index:c2(c2)	range:[-inf,10), keep order:false, stats:pseudo
  └─Selection(Probe)	cop[tikv]		eq(length(substring(cast(sqrt(cast(index_merge.t1.c3, double BINARY)), var_string(370)), 1, 1)), char_length(cast(if(index_merge.t1.c1, index_merge.t1.c2, index_merge.t1.c3), var_string(20))))
    └─TableRowIDScan	cop[tikv]	table:t1	keep order:false, stats:pseudo
select /*+ use_index_merge(t1) */ * from t1 where (c1 < 10 or c2 < 10) and length(substring(sqrt(c3), @a, 1)) = char_length(if(c1, c2, c3)) order by 1;
c1	c2	c3	c4	c5
1	1	1	1	1
2	2	2	2	2
3	3	3	3	3
4	4	4	4	4
5	5	5	5	5
///// CTE
drop table if exists t1;
create table t1(c1 int, c2 int, c3 int, c4 int, c5 int, key(c1), key(c2), key(c3), key(c4));
insert into t1 values(1, 1, 1, 1, 1), (2, 2, 2, 2, 2), (3, 3, 3, 3, 3), (4, 4, 4, 4, 4), (5, 5, 5, 5, 5);
explain format = 'plan_tree' with cte1 as (select /*+ use_index_merge(t1) */ * from t1 where c1 < 10 or c2 < 10 and c3 < 10) select * from cte1 order by 1;
id	task	access object	operator info
Sort	root		index_merge.t1.c1
└─IndexMerge	root		type: union
  ├─IndexRangeScan(Build)	cop[tikv]	table:t1, index:c1(c1)	range:[-inf,10), keep order:false, stats:pseudo
  ├─IndexRangeScan(Build)	cop[tikv]	table:t1, index:c2(c2)	range:[-inf,10), keep order:false, stats:pseudo
  └─Selection(Probe)	cop[tikv]		or(lt(index_merge.t1.c1, 10), and(lt(index_merge.t1.c2, 10), lt(index_merge.t1.c3, 10)))
    └─TableRowIDScan	cop[tikv]	table:t1	keep order:false, stats:pseudo
with cte1 as (select /*+ use_index_merge(t1) */ * from t1 where c1 < 10 or c2 < 10 and c3 < 10) select * from cte1 order by 1;
c1	c2	c3	c4	c5
1	1	1	1	1
2	2	2	2	2
3	3	3	3	3
4	4	4	4	4
5	5	5	5	5
explain format = 'plan_tree' with recursive cte1 as (select /*+ use_index_merge(t1) */ c1 from t1 where c1 < 10 or c2 < 10 and c3 < 10 UNION ALL select c1 + 100 from cte1 where c1 < 10) select * from cte1 order by 1;
id	task	access object	operator info
Sort	root		index_merge.t1.c1
└─CTEFullScan	root	CTE:cte1	data:CTE_0
CTE_0	root		Recursive CTE
├─Projection(Seed Part)	root		index_merge.t1.c1
│ └─IndexMerge	root		type: union
│   ├─IndexRangeScan(Build)	cop[tikv]	table:t1, index:c1(c1)	range:[-inf,10), keep order:false, stats:pseudo
│   ├─IndexRangeScan(Build)	cop[tikv]	table:t1, index:c2(c2)	range:[-inf,10), keep order:false, stats:pseudo
│   └─Selection(Probe)	cop[tikv]		or(lt(index_merge.t1.c1, 10), and(lt(index_merge.t1.c2, 10), lt(index_merge.t1.c3, 10)))
│     └─TableRowIDScan	cop[tikv]	table:t1	keep order:false, stats:pseudo
└─Projection(Recursive Part)	root		cast(plus(index_merge.t1.c1, 100), int)->index_merge.t1.c1
  └─Selection	root		lt(index_merge.t1.c1, 10)
    └─CTETable	root		Scan on CTE_0
with recursive cte1 as (select /*+ use_index_merge(t1) */ c1 from t1 where c1 < 10 or c2 < 10 and c3 < 10 UNION ALL select c1 + 100 from cte1 where c1 < 10) select * from cte1 order by 1;
c1
1
2
3
4
5
101
102
103
104
105
explain format = 'plan_tree' with recursive cte1 as (select 1 c1, 1 c2, 1 c3 UNION ALL select /*+ use_index_merge(t_alias) */ c1 + 1, c2 + 1, c3 + 1 from cte1 t_alias where c1 < 10 or c2 < 10 and c3 < 10) select * from cte1 order by 1;
id	task	access object	operator info
Sort	root		Column
└─CTEFullScan	root	CTE:cte1	data:CTE_0
CTE_0	root		Recursive CTE
├─Projection(Seed Part)	root		1->Column, 1->Column, 1->Column
│ └─TableDual	root		rows:1
└─Projection(Recursive Part)	root		cast(plus(Column, 1), bigint BINARY)->Column, cast(plus(Column, 1), bigint BINARY)->Column, cast(plus(Column, 1), bigint BINARY)->Column
  └─Selection	root		or(lt(Column, 10), and(lt(Column, 10), lt(Column, 10)))
    └─CTETable	root		Scan on CTE_0
show warnings;
Level	Code	Message
Warning	1815	use_index_merge(index_merge.t_alias) is inapplicable, check whether the table(index_merge.t_alias) exists
Warning	1815	use_index_merge(index_merge.t_alias) is inapplicable, check whether the table(index_merge.t_alias) exists
with recursive cte1 as (select 1 c1, 1 c2, 1 c3 UNION ALL select /*+ use_index_merge(t_alias) */ c1 + 1, c2 + 1, c3 + 1 from cte1 t_alias where c1 < 10 or c2 < 10 and c3 < 10) select * from cte1 order by 1;
c1	c2	c3
1	1	1
2	2	2
3	3	3
4	4	4
5	5	5
6	6	6
7	7	7
8	8	8
9	9	9
10	10	10
