SELECT column_name, data_type, is_nullable
FROM information_schema.columns
WHERE table_schema = 'mysql'
AND table_name = 'tidb_runaway_queries'
AND column_name = 'update_time';
column_name	data_type	is_nullable
update_time	timestamp	NO
SELECT column_name, seq_in_index, non_unique
FROM information_schema.statistics
WHERE table_schema = 'mysql'
AND table_name = 'tidb_runaway_queries'
AND index_name = 'PRIMARY'
ORDER BY seq_in_index;
column_name	seq_in_index	non_unique
resource_group_name	1	0
sql_digest	2	0
plan_digest	3	0
match_type	4	0
SELECT index_name, column_name
FROM information_schema.statistics
WHERE table_schema = 'mysql'
AND table_name = 'tidb_runaway_queries'
AND index_name = 'update_time_index';
index_name	column_name
update_time_index	update_time
DELETE FROM mysql.tidb_runaway_queries WHERE resource_group_name = 'rg_inttest_dedup';
INSERT INTO mysql.tidb_runaway_queries
(resource_group_name, start_time, update_time, match_type, action, sample_sql, sql_digest, plan_digest, tidb_server, rule, repeats)
VALUES
('rg_inttest_dedup','2024-01-01 00:00:00','2024-01-01 00:00:01','identify','DRYRUN','select 1','d1','p1','srv1','',1)
ON DUPLICATE KEY UPDATE repeats = repeats + VALUES(repeats), update_time = GREATEST(update_time, VALUES(update_time));
INSERT INTO mysql.tidb_runaway_queries
(resource_group_name, start_time, update_time, match_type, action, sample_sql, sql_digest, plan_digest, tidb_server, rule, repeats)
VALUES
('rg_inttest_dedup','2024-01-02 00:00:00','2024-01-01 00:00:10','identify','DRYRUN','select 1','d1','p1','srv2','',3)
ON DUPLICATE KEY UPDATE repeats = repeats + VALUES(repeats), update_time = GREATEST(update_time, VALUES(update_time));
SELECT resource_group_name, start_time, update_time, repeats
FROM mysql.tidb_runaway_queries
WHERE resource_group_name = 'rg_inttest_dedup';
resource_group_name	start_time	update_time	repeats
rg_inttest_dedup	2024-01-01 00:00:00	2024-01-01 00:00:10	4
DELETE FROM mysql.tidb_runaway_queries WHERE resource_group_name = 'rg_inttest_dedup';
DELETE FROM mysql.tidb_runaway_queries WHERE resource_group_name = 'rg_inttest_greatest';
INSERT INTO mysql.tidb_runaway_queries
(resource_group_name, start_time, update_time, match_type, action, sample_sql, sql_digest, plan_digest, tidb_server, rule, repeats)
VALUES
('rg_inttest_greatest','2024-01-01 00:00:00','2024-01-10 12:00:00','identify','DRYRUN','select 1','d2','p2','srv1','',5)
ON DUPLICATE KEY UPDATE repeats = repeats + VALUES(repeats), update_time = GREATEST(update_time, VALUES(update_time));
INSERT INTO mysql.tidb_runaway_queries
(resource_group_name, start_time, update_time, match_type, action, sample_sql, sql_digest, plan_digest, tidb_server, rule, repeats)
VALUES
('rg_inttest_greatest','2024-01-01 00:00:00','2024-01-01 06:00:00','identify','DRYRUN','select 1','d2','p2','srv2','',1)
ON DUPLICATE KEY UPDATE repeats = repeats + VALUES(repeats), update_time = GREATEST(update_time, VALUES(update_time));
SELECT resource_group_name, update_time, repeats
FROM mysql.tidb_runaway_queries
WHERE resource_group_name = 'rg_inttest_greatest';
resource_group_name	update_time	repeats
rg_inttest_greatest	2024-01-10 12:00:00	6
DELETE FROM mysql.tidb_runaway_queries WHERE resource_group_name = 'rg_inttest_greatest';
DELETE FROM mysql.tidb_runaway_queries WHERE resource_group_name = 'rg_inttest_pk';
INSERT INTO mysql.tidb_runaway_queries
(resource_group_name, start_time, update_time, match_type, action, sample_sql, sql_digest, plan_digest, tidb_server, rule, repeats)
VALUES
('rg_inttest_pk','2024-01-01 00:00:00','2024-01-01 00:00:00','identify','DRYRUN','select 1','d3','p3','srv1','',1);
INSERT INTO mysql.tidb_runaway_queries
(resource_group_name, start_time, update_time, match_type, action, sample_sql, sql_digest, plan_digest, tidb_server, rule, repeats)
VALUES
('rg_inttest_pk','2024-01-01 00:00:00','2024-01-01 00:00:00','identify','DRYRUN','select 1','d3','p3','srv1','',1);
Error 1062 (23000): Duplicate entry 'rg_inttest_pk-d3-p3-identify' for key 'tidb_runaway_queries.PRIMARY'
DELETE FROM mysql.tidb_runaway_queries WHERE resource_group_name = 'rg_inttest_pk';
